,upvotes,title,site,time_posted,post_age,comment_no
165,4,"The wife of ex-Malaysian Prime Minister Najib Razak has been charged with money laundering and tax evasion, as part of an investigation into a massive corruption scandal.",bbc.com,2018-10-04 11:19:42,0 days 10:29:52.371446000,1
166,0,Car sales plunge as Nissan warns on Brexit,bbc.com,2018-10-04 11:12:31,0 days 10:37:03.371446000,0
167,4,Japan's Abe claims lone woman in his cabinet worth 'two or three' amid criticism,cnn.com,2018-10-04 11:09:07,0 days 10:40:27.371447000,0
168,7,Russia 'targeted chemical weapons body',bbc.co.uk,2018-10-04 11:06:02,0 days 10:43:32.371447000,4
169,1027,Poll: Trump increasingly unpopular globally - except in Israel,israelnationalnews.com,2018-10-04 11:03:09,0 days 10:46:25.371447000,354
170,22,"23 endangered Asiatic lions are dead in last 20 days in Gujarat, India",dailymail.co.uk,2018-10-04 10:59:42,0 days 10:49:52.371448000,4
171,19,UK man rescued after 'living in six-foot shed for 40 years',edition.cnn.com,2018-10-04 10:55:23,0 days 10:54:11.371448000,4
172,3,Federal judge rules that Tesla must defend itself at a trial over allegations it knew foreign workers at its assembly plant were threatened with deportation if they reported an injury and worked long shifts that violated forced labour laws,reuters.com,2018-10-04 10:54:38,0 days 10:54:56.371448000,0
173,10,"Saak Karapetyan, Deputy General Prosecutor of Russia, just died in a helicopter crash in Kostroma, Russia. He was official who signed documents prepared by Natalia Veselnitskaya sent to US DOJ to try exonerate Prevezon in US money laundering case",themoscowtimes.com,2018-10-04 10:54:37,0 days 10:54:57.371449000,4
174,2,Burkina Faso gendarme killed in attack on Inata gold mine in Soum province,thedefensepost.com,2018-10-04 10:51:09,0 days 10:58:26.416322000,0
175,35,UK exposes Russian cyber attacks,gov.uk,2018-10-04 10:49:27,0 days 11:00:08.416327000,4
176,7,"Tesla to face charges that it threatened to deport workers if they reported injuries - Workers claim they were paid less than minimum wage, and that Tesla threatened to deport foreign employees if they reported work-related injuries and withhold their wages if they called into work sick",mercurynews.com,2018-10-04 10:37:00,0 days 11:12:35.416327000,0
177,24,"Up to 10,000 attend rally in Dublin demanding end to the country's housing crisis",irishtimes.com,2018-10-04 10:33:01,0 days 11:16:34.416328000,4
178,17700,"Dutch security services expelled four Russians in April over a plot targeting the global chemical weapons watchdog, officials said.",bbc.co.uk,2018-10-04 10:18:16,0 days 11:31:19.416328000,674
179,3,Singapore to replace paper arrival cards for foreign visitors with electronic version,channelnewsasia.com,2018-10-04 10:17:24,0 days 11:32:11.416329000,0
180,9,Russia Listed Among World Leaders in Selfie Deaths – Study,themoscowtimes.com,2018-10-04 10:10:03,0 days 11:39:32.416329000,3
181,10,"Indian man who tried to extort $500,000 from Standard Chartered Bank charged in court",straitstimes.com,2018-10-04 10:00:50,0 days 11:48:45.416329000,0
182,645,Tesla to face charges that it threatened to deport foreign workers if they reported injuries,mercurynews.com,2018-10-04 09:54:41,0 days 11:54:54.416330000,47
183,7,"Two men dead at Banham Poultry factory in Norfolk, UK, just hours after it went into administration",edp24.co.uk,2018-10-04 09:30:31,0 days 12:19:04.416330000,8
184,3,Greek fishermen claim Turkish coastguard tried to ram their boat,en.protothema.gr,2018-10-04 09:26:56,0 days 12:22:39.416330000,1
185,3891,Last pocket of ISIS' fighters surrounded,militarytimes.com,2018-10-04 09:20:19,0 days 12:29:16.416331000,757
186,2,False quake alarm gives Tokyoites a midnight scare | The Japan Times,japantimes.co.jp,2018-10-04 09:15:11,0 days 12:34:24.416331000,4
187,4,"Canada relieved trade deal done, won’t forget Trump attacks",apnews.com,2018-10-04 08:44:24,0 days 13:05:11.416332000,11
188,17,"US, Chinese unease as Putin seeks India arms deals",france24.com,2018-10-04 09:08:19,0 days 12:41:16.416332000,5
189,26,Deadly bacteria warning goes out to visitors of Berlin sex club,dw.com,2018-10-04 09:00:50,0 days 12:48:45.416332000,5
190,8,Six rescue divers drown trying to save teen in Malaysia,bbc.co.uk,2018-10-04 09:00:18,0 days 12:49:17.416333000,3
191,111,Netflix Eats Up 15% of All Internet Downstream Traffic Worldwide (Study),variety.com,2018-10-04 08:57:34,0 days 12:52:01.416333000,65
192,18,Fake News in Academia - Three scholars gulled academic journals to publish hoax papers on ‘grievance studies.’,areomagazine.com,2018-10-04 08:56:55,0 days 12:52:40.416333000,9
193,1,Car sales plunge as Nissan warns on Brexit,bbc.com,2018-10-04 08:46:12,0 days 13:03:23.416334000,0
194,2,"After trade deal win, Trump doubles down on China",aljazeera.com,2018-10-04 08:43:59,0 days 13:05:36.416334000,4
195,39,Germany's Merkel visits Holocaust memorial in Jerusalem,reuters.com,2018-10-04 08:20:05,0 days 13:29:30.416334000,6
196,7,Drunk police officer shoots dead two colleagues in Addis Ababa: state media,reuters.com,2018-10-04 08:42:14,0 days 13:07:21.416335000,1
197,56,UK points finger at Kremlin's military intelligence,bbc.co.uk,2018-10-04 08:33:28,0 days 13:16:07.416335000,6
198,8,Honda to invest $2.75 billion in GM's self-driving car unit,reuters.com,2018-10-04 08:32:50,0 days 13:16:45.416335000,1
199,11,Man and his 12 yo lover suspected of murder and cannibalism,en.crimerussia.com,2018-10-04 08:23:36,0 days 13:26:00.436479000,19
200,8,Indonesian anti-government activist Ratna Sarumpaet claimed she was assaulted. Turns out she was having a plastic surgery.,thejakartapost.com,2018-10-04 08:18:47,0 days 13:30:49.436483000,3
201,4,Six rescue divers in Malaysia drown while searching for missing teen,channelnewsasia.com,2018-10-04 08:16:49,0 days 13:32:47.436484000,1
202,2,Paramedics responding to reported shooting at Nepean Hospital in Sydney's west,abc.net.au,2018-10-04 07:43:02,0 days 14:06:34.436484000,1
203,4,Indonesia tsunami: crisis worsens as aid struggles to reach island,theguardian.com,2018-10-04 07:40:47,0 days 14:08:49.436485000,1
204,5,Dutch Christmas character Black Pete to shed blackface for TV,theguardian.com,2018-10-04 07:30:54,0 days 14:18:42.436485000,12
205,50600,Osaka has ended its 60-year “sister city” relationship with San Francisco to protest against the presence in the US city of a statue symbolising Japan’s wartime use of sex slaves.,theguardian.com,2018-10-04 07:29:01,0 days 14:20:35.436485000,6674
206,24,EU considers trade sanctions on Myanmar over Rohingya crisis,reuters.com,2018-10-04 07:23:32,0 days 14:26:04.436486000,41
207,15,Pompeo backs away from North Korea denuclearisation timeline,theguardian.com,2018-10-04 07:22:49,0 days 14:26:47.436486000,3
208,50,"World vulnerable to another financial meltdown, IMF warns",abc.net.au,2018-10-04 06:59:10,0 days 14:50:26.436486000,19
209,11,Paramedics responding to reported shooting at Nepean Hospital in Sydney's west,mobile.abc.net.au,2018-10-04 06:54:56,0 days 14:54:40.436487000,0
210,18,2 men arrested from K’taka charged with plotting Dalai Lama’s assassination in Bodh Gaya,thenewsminute.com,2018-10-04 06:38:07,0 days 15:11:29.436487000,12
211,723,"‘Terror being waged on wildlife', leaders warn - National and conservation leaders say the annihilation of nature is a dangerous ‘blight on humanity’, ahead of major summit",theguardian.com,2018-10-04 06:35:06,0 days 15:14:30.436488000,39
212,0,Wentworth byelection: Liberal vote collapses as poll shows safe seat now a close contest | Australia news,theguardian.com,2018-10-04 06:31:42,0 days 15:17:54.436488000,0
213,0,Russia’s growing threat to north Europe,economist.com,2018-10-04 06:25:45,0 days 15:23:51.436488000,7
214,1,New Zealand to fine travellers refusing to give device passwords when requested,news.com.au,2018-10-04 06:21:21,0 days 15:28:15.436489000,13
215,26,North Korean hackers accused of stealing millions from global banks,foxnews.com,2018-10-04 06:13:19,0 days 15:36:17.436489000,9
216,10,"Iraq’s New Leaders Seen as Technocrats, in a Break From Sectarian Politics",nytimes.com,2018-10-04 06:07:09,0 days 15:42:27.436489000,2
217,105,"A teacher accused of having sex with a 16-year-old pupil in a plane toilet admitted to police she had flirted with him, a jury has heard",theguardian.com,2018-10-04 06:04:58,0 days 15:44:38.436490000,82
218,2,US Vice President Pence set to inflame China tensions: 'We will not be intimidated',edition.cnn.com,2018-10-04 06:03:32,0 days 15:46:04.436490000,8
219,6,"Mexican mystery leaves locals tied, naked to lamposts in Puerto Vallarta",nzherald.co.nz,2018-10-04 05:55:48,0 days 15:53:48.436490000,5
220,8,"Merkel begins visit to Israel with Iran, Palestinians on agenda",reuters.com,2018-10-04 05:54:56,0 days 15:54:40.436491000,3
221,17,U.S. first lady Melania Trump lays wreath at slave castle in Ghana,reuters.com,2018-10-04 05:53:33,0 days 15:56:03.436491000,12
222,5,Pence to tell China: We will not be intimidated in South China Sea,reuters.com,2018-10-04 05:52:10,0 days 15:57:26.436491000,11
223,2,UK's May planning to rush Brexit through parliament: Bloomberg,reuters.com,2018-10-04 05:51:39,0 days 15:57:57.436492000,3
224,4,US Airstrike Kills 9 al-Shabab Militants in Somalia,voanews.com,2018-10-04 05:45:22,0 days 16:04:15.355208000,0
225,11,Anatoliy Chepiga Is a Hero of Russia: The Writing Is on the Wall,bellingcat.com,2018-10-04 05:28:02,0 days 16:21:35.355212000,0
226,43,"Astronomers discover first suspected 'exomoon' 8,000 light years away",theguardian.com,2018-10-04 05:24:12,0 days 16:25:25.355212000,3
227,16,"China Wants To End Trade War But 'U.S. Position Keeps Changing,' Ambassador Says",npr.org,2018-10-04 05:19:28,0 days 16:30:09.355213000,16
228,15,"Apple, Google and Amazon named as most valuable brands in world",theguardian.com,2018-10-04 05:14:58,0 days 16:34:39.355213000,9
229,4,Peru's high court overturns pardon of former strongman Fujimori | World news,theguardian.com,2018-10-04 05:11:01,0 days 16:38:36.355214000,0
230,2456,Facebook faces $1.6bn fine and formal investigation over massive data breach,theguardian.com,2018-10-04 05:05:07,0 days 16:44:30.355214000,230
231,4,Beijing develops self-driving sanitation vehicle - Xinhua,xinhuanet.com,2018-10-04 04:53:01,0 days 16:56:36.355214000,1
232,6,"Trump is right that China uses its media to influence foreign opinion, but so does Washington",cnn.com,2018-10-04 04:52:20,0 days 16:57:17.355215000,13
233,200,"Cristiano Ronaldo will face prison time if found guilty, attorney says",usatoday.com,2018-10-04 04:43:58,0 days 17:05:39.355215000,84
234,16,EU launches €1B project to build world’s fastest supercomputer,sciencebusiness.net,2018-10-04 04:37:38,0 days 17:11:59.355215000,5
235,626,Putin Signs Unpopular Bill Raising Retirement Ages By Five Years,rferl.org,2018-10-04 04:36:34,0 days 17:13:03.355216000,155
236,16,Calls for Justin Trudeau to rebuff President Trump's mocking of Blasey Ford,msn.com,2018-10-04 04:25:10,0 days 17:24:27.355216000,11
237,46,Victims of forced sterilisation in Japan fight for compensation,economist.com,2018-10-04 04:25:02,0 days 17:24:35.355216000,4
238,55,UK: Russian spies behind the supposed ISIS ‘Cyber Caliphate’,washingtonexaminer.com,2018-10-04 04:09:42,0 days 17:39:55.355217000,39
239,8,South Korean Lawmaker Heads Rally in Washington to Oppose end-of-war Declaration With N Korea,sputniknews.com,2018-10-04 04:07:45,0 days 17:41:52.355217000,3
240,7,South Korea's economy is slowing. Its leader still wants to spend millions on Pyongyang,cnbc.com,2018-10-04 04:06:36,0 days 17:43:01.355218000,7
241,66,Indonesian soldiers ordered to fire on looters in disaster zone,channelnewsasia.com,2018-10-04 04:04:31,0 days 17:45:06.355218000,26
242,27,Woman hit by golf ball at Ryder Cup: People took photos instead of helping,news.sky.com,2018-10-04 03:58:21,0 days 17:51:16.355218000,22
243,11,Vietnam's Former Communist Party Chief Do Muoi Dies at 101,time.com,2018-10-04 03:57:45,0 days 17:51:52.355219000,3
244,6,"The Australian government is jointly responsible for Nauru’s media access policy for the immigration detention centre, departmental documents reveal, despite claims for years that it is solely an issue for Nauru.",theguardian.com,2018-10-04 03:54:47,0 days 17:54:50.355219000,0
245,15,Mike Pence to warn against Chinese 'intimidation' in South China Sea,theguardian.com,2018-10-04 03:53:49,0 days 17:55:48.355220000,10
246,11,Indonesia earthquake: soil liquefaction blamed for building collapses,theguardian.com,2018-10-04 03:49:59,0 days 17:59:38.355220000,0
247,11,Contaminated vaccines put India’s ‘polio free’ status at risk,m.timesofindia.com,2018-10-04 03:30:21,0 days 18:19:16.355220000,1
248,12,UK blames Russian military for 'reckless' cyber attacks,edition.cnn.com,2018-10-04 03:28:36,0 days 18:21:01.355221000,3
249,30,"India, in a first, sends seven Rohingya for deportation to Myanmar",in.reuters.com,2018-10-04 03:27:43,0 days 18:21:54.999349000,12
250,1,Vietnam nominates Communist Party chief to become president,washingtonpost.com,2018-10-04 03:22:23,0 days 18:27:14.999353000,3
251,2,Malaysia ex-PM’s wife to face money laundering charges,washingtonpost.com,2018-10-04 03:20:38,0 days 18:28:59.999353000,1
252,27,"Russian President Vladimir Putin arrives in India today, likely to sign 20 agreements | The Indian Express",indianexpress.com,2018-10-04 02:58:21,0 days 18:51:16.999354000,5
253,36,UK accuses Russian spies of cyber attacks,bbc.co.uk,2018-10-04 02:52:30,0 days 18:57:07.999354000,0
254,15,Nicaragua deports reporter who covered anti-Ortega protests | World news,theguardian.com,2018-10-04 02:50:30,0 days 18:59:07.999354000,0
255,23,Osaka cuts sister city ties with San Francisco over 'comfort women' statue,japantoday.com,2018-10-04 02:44:57,0 days 19:04:40.999355000,37
256,5,People entering New Zealand may now be prosecuted and fined if they refuse to allow access to their digital devices,nytimes.com,2018-10-04 02:40:59,0 days 19:08:38.999355000,15
257,31,An Australian university has developed a font that promises to improve memory and information recall.,theage.com.au,2018-10-04 02:11:40,0 days 19:37:57.999355000,8
258,77,"A federal judge issued a preliminary injunction on Wednesday evening, temporarily blocking the Trump administration from ending the Temporary Protected Status (TPS) program for over 300,000 immigrants from Haiti, El Salvador, Honduras and Sudan",thehill.com,2018-10-04 02:05:58,0 days 19:43:39.999356000,5
259,36,‘Pretty darn Canadian’: Trumpet player serenades snow-stranded drivers on Alberta highway,globalnews.ca,2018-10-04 02:03:32,0 days 19:46:05.999356000,8
260,12,Erik Prince’s Russian Connection Trawled Trumpland for ‘Boss’ Putin,thedailybeast.com,2018-10-04 01:49:45,0 days 19:59:52.999357000,3
261,22,Germany to further ease immigration rules,yahoo.com,2018-10-04 01:32:15,0 days 20:17:22.999357000,32
262,36,"Today, the Australian Government has joined international partners to condemn a pattern of malicious cyber activity by Russia targeting political, business, media and sporting institutions worldwide.",pm.gov.au,2018-10-04 01:31:19,0 days 20:18:18.999357000,0
263,8,Trump says Saudi King wouldn't last 'two weeks' without US support,edition.cnn.com,2018-10-04 01:14:51,0 days 20:34:46.999358000,14
264,88,Erik Prince’s Russian Connection Trawled Trumpland for ‘Boss’ Putin,thedailybeast.com,2018-10-04 01:11:02,0 days 20:38:35.999358000,9
265,8,Erik Prince’s Russian Connection Trawled Trumpland for ‘Boss’ Putin,thedailybeast.com,2018-10-04 01:10:42,0 days 20:38:55.999358000,2
266,17,North Korea said to have stolen a fortune in online bank heists,apnews.com,2018-10-04 01:08:34,0 days 20:41:03.999359000,4
267,677,"U.S. withdraws from international accords, says U.N. world court 'politicized'",reuters.com,2018-10-04 01:05:05,0 days 20:44:32.999359000,260
268,123,Cannabis 'more harmful than alcohol' for teen brains - Study from Canada,bbc.com,2018-10-04 00:45:54,0 days 21:03:43.999359000,128
269,6,Trump was 'tolerant' in trade talks: Mexico president-elect,reuters.com,2018-10-04 00:45:48,0 days 21:03:49.999360000,4
270,32,"Mexican president-elect, Trump agree economic development can stem illegal migration",reuters.com,2018-10-04 00:43:55,0 days 21:05:42.999360000,7
271,3268,Trump says Saudi King wouldn't last 'two weeks' without US support,edition.cnn.com,2018-10-04 00:29:04,0 days 21:20:33.999360000,785
272,2,Yemen separatists call for uprising as U.N. pursues peace,reuters.com,2018-10-04 00:11:43,0 days 21:37:54.999361000,2
273,93,A French gangster who busted out of jail in a helicopter has been caught after 3 months on the run,businessinsider.com,2018-10-03 23:51:51,0 days 21:57:46.999361000,18
