,upvotes,title,site,time_posted,post_age,comment_no
0,0,"Congress response to report on China microchip Apple, Amazon hack",businessinsider.com,2018-10-04 21:43:41,0 days 00:05:48.202426000,0
1,0,Oh no! The Zika virus is now in Taiwan,telegraph.co.uk,2018-10-04 21:35:33,0 days 00:13:56.202429000,1
2,0,"Taxi receipt, records appear to link alleged hackers to GRU",apnews.com,2018-10-04 21:32:14,0 days 00:17:15.202430000,0
3,0,"Oman plans pipeline to Iran as US sanctions loom. Muscat is moving ahead with a planned natural gas pipeline to Iran, hopeful that US sanctions to be imposed November 5 will strictly target oil",atimes.com,2018-10-04 21:31:53,0 days 00:17:36.202430000,0
4,0,President of Kosovo says chance for border deal with Serbia must be acted on despite low hopes of success,reuters.com,2018-10-04 21:10:35,0 days 00:38:54.202431000,0
5,0,NZ customs can now demand phone or laptop passwords,zdnet.com,2018-10-04 21:03:36,0 days 00:45:53.202431000,3
6,0,Russia arrests second historian of Stalin’s Terror,khpg.org,2018-10-04 21:03:09,0 days 00:46:20.202431000,2
7,0,Pakistani ice-cream seller unaware of £14m in his bank account | World news,theguardian.com,2018-10-04 20:49:06,0 days 01:00:23.202432000,0
8,0,U.S. indicts Russians in hacking of nuclear company Westinghouse,reuters.com,2018-10-04 20:37:02,0 days 01:12:27.202432000,11
9,0,The Pakistani government has ordered international NGOs to end their operations and leave the country within 60 days.,bbc.co.uk,2018-10-04 20:32:47,0 days 01:16:42.202433000,2
10,0,"U.S. Senate Passes Resolution On Ukraine Famine, A Move Hailed by Kyiv",rferl.org,2018-10-04 20:30:43,0 days 01:18:46.202433000,0
11,0,Saudi critic missing after entering Istanbul consulate,edition.cnn.com,2018-10-04 20:24:24,0 days 01:25:05.202433000,0
12,0,"DARPA is making insects that can deliver biological weapons, scientists have claimed",newsweek.com,2018-10-04 20:16:10,0 days 01:33:19.202434000,17
13,0,Global markets show concerns as the effective interest rate on 10-year benchmark US bonds increases,theguardian.com,2018-10-04 20:11:22,0 days 01:38:07.202434000,1
14,0,World markets rattled by US inflation concerns,theguardian.com,2018-10-04 20:01:01,0 days 01:48:28.202434000,3
15,0,Romania's constitutional court backs rights for gay couples,euractiv.com,2018-10-04 19:52:41,0 days 01:56:48.202435000,2
16,5,Bedouin Children whose village is under a demolition order stage sit-in near Israeli president's home,aljazeera.com,2018-10-04 19:46:03,0 days 02:03:26.202435000,1
17,13,"No doubt Iran behind foiled Paris attack, says French diplomatic source",haaretz.com,2018-10-04 19:45:41,0 days 02:03:48.202435000,2
18,11,Unprecedented violence towards the press continues: Mexico's tenth journalist killed this year,aztecreports.com,2018-10-04 19:36:01,0 days 02:13:28.202436000,0
19,11,Fancy Bear's trail of blunders: Russian hackers used budget mobiles and 'high-grade' Wi-Fi equipment,dailymail.co.uk,2018-10-04 19:24:13,0 days 02:25:16.202436000,2
20,35,305 Car Registrations May Point to Massive GRU Security Breach - bellingcat,bellingcat.com,2018-10-04 18:56:34,0 days 02:52:55.202436000,8
21,1,Italian-flagged migrant rescue boat defies anti immigration minister,theguardian.com,2018-10-04 18:56:04,0 days 02:53:25.202437000,1
22,29,"In Jerusalem, Merkel says Palestinians must accept Israel as Jewish state; visiting German chancellor says Berlin endorses two-state solution, but there are ‘many’ other possible ways to solve conflict",timesofisrael.com,2018-10-04 18:53:08,0 days 02:56:21.202437000,29
23,2,Russia claims US running secret bio weapons lab in Georgia,apnews.com,2018-10-04 18:26:42,0 days 03:22:47.202438000,12
24,24,US Navy proposing major show of force to warn China,cnn.com,2018-10-04 18:26:31,0 days 03:22:58.202438000,31
25,10,More than 250 people around the world have died taking selfies since 2011,cnn.com,2018-10-04 18:26:19,0 days 03:23:11.096236000,15
26,18,Swedish far-right party submits motion calling for circumcision ban,timesofisrael.com,2018-10-04 18:16:07,0 days 03:33:23.096240000,17
27,2,'Black Night': Upgraded tank for UK army unveiled by BAE Systems,news.sky.com,2018-10-04 18:15:53,0 days 03:33:37.096240000,2
28,15,"MI5 provides immunity for agents' criminal acts, tribunal told",theguardian.com,2018-10-04 18:09:12,0 days 03:40:18.096241000,2
29,2,Sikh group plans to hold Khalistan referendum polling in Canadian cities in 2020,globalnews.ca,2018-10-04 18:08:02,0 days 03:41:28.096241000,2
30,77,USMCA leaves in place the Canadian dairy tariffs Trump said ‘we’re not going to stand for’ | The Star,thestar.com,2018-10-04 18:07:59,0 days 03:41:31.096241000,17
31,3,Turkey summons Saudi envoy over Jamal Khashoggi's disappearance,aljazeera.com,2018-10-04 18:03:23,0 days 03:46:07.096242000,2
32,13,France Freezes Iranian Assets Over Bomb Plot Blamed on Tehran,wsj.com,2018-10-04 18:02:54,0 days 03:46:36.096242000,2
33,25,"EU chief attacks USSR comparison. ""As the president of the European council and someone who spent half of my life in the Soviet bloc, I know what I am talking about.”",theguardian.com,2018-10-04 18:02:08,0 days 03:47:22.096242000,8
34,14,Body parts pile up as NHS supplier fails to dispose of human waste,theguardian.com,2018-10-04 17:59:31,0 days 03:49:59.096243000,6
35,44,"Russian Official Tied to Natalia Veselnitskaya, the Trump Tower Lawyer, Is Dead",thedailybeast.com,2018-10-04 17:55:09,0 days 03:54:21.096243000,8
36,17,Top Russian law official die in crash hours before GRU spies are outed,dailymail.co.uk,2018-10-04 17:54:31,0 days 03:54:59.096243000,5
37,19,"In word first, doctors intentionally transplant liver from HIV positive mother to HIV negative daughter",iol.co.za,2018-10-04 17:46:22,0 days 04:03:08.096244000,9
38,848,"Russian Official Linked to Natalia Veselnitskaya, the Trump Tower Lawyer, Is Dead",thedailybeast.com,2018-10-04 17:44:13,0 days 04:05:17.096244000,115
39,5,"India, Russia to sign economic agreements, discuss rupee-rouble payment mechanism",thehindubusinessline.com,2018-10-04 17:39:04,0 days 04:10:26.096244000,0
40,3,A ‘fifth freedom’ of the EU: MEPs back an end to data localisation,euractiv.com,2018-10-04 17:31:27,0 days 04:18:03.096245000,1
41,6,Saudi woman barred from marrying man who 'once played musical instrument' by appeals court.,bbc.com,2018-10-04 17:29:41,0 days 04:19:49.096245000,4
42,4,Seven Russian nationals have been charged with conspiracy for allegedly hacking anti-doping agencies of the Olympic Games and other organizations to retaliate for their role in publicly exposing a Russian state-sponsored athlete doping program,abcnews.go.com,2018-10-04 17:28:19,0 days 04:21:11.096246000,1
43,9,"US, Chinese unease as Putin seeks India arms deals",taipeitimes.com,2018-10-04 17:21:08,0 days 04:28:22.096246000,2
44,41,'Enough lies!': Bosnian village bans politicians,afp.com,2018-10-04 17:20:01,0 days 04:29:29.096246000,7
45,13,NATO to hold largest war exercises since end of cold war in Northern Europe,euractiv.com,2018-10-04 17:18:17,0 days 04:31:13.096247000,3
46,4,"U.S. sanctions Turkish firm, North Korean diplomat for weapons trade",in.reuters.com,2018-10-04 17:17:23,0 days 04:32:07.096247000,0
47,7,"US, EU should ‘clean the house’ and deal with China – US ambassador",euractiv.com,2018-10-04 17:15:27,0 days 04:34:03.096247000,2
48,3,Takeda alumni question Shire purchase in open letter,asia.nikkei.com,2018-10-04 17:08:07,0 days 04:41:23.096248000,0
49,54,Switzerland votes to send people to prison for homophobia and transphobia – PinkNews,pinknews.co.uk,2018-10-04 16:37:09,0 days 05:12:21.096248000,73
50,5,France announces new terrorism research centre - ITCT,itct.org.uk,2018-10-04 16:36:33,0 days 05:12:57.946603000,0
51,13,New nuclear weapons will arm US stealth aircraft,video.foxnews.com,2018-10-04 16:35:02,0 days 05:14:28.946606000,22
52,3,European Union approves content quota for streaming services,bloomberg.com,2018-10-04 16:32:09,0 days 05:17:21.946607000,12
53,16,Italian ‘Robin Hood’ was convicted of stealing more than $1 million and giving it to the poor. But he won’t go to jail.,washingtonpost.com,2018-10-04 16:26:24,0 days 05:23:06.946607000,1
54,21,"Google DeepMind Given Access To Mammograms Of 30,000 Women By Japanese Hospital",forbes.com,2018-10-04 16:23:49,0 days 05:25:41.946607000,7
55,55,U.S. not invited to Canada’s save-the-WTO summit of 13 'like-minded’ countries,theglobeandmail.com,2018-10-04 16:23:04,0 days 05:26:26.946608000,17
56,73,Russian spies caught drinking on job with bag of empty Heineken cans in attempted cyber attack on OPCW in Netherlands,dailystar.co.uk,2018-10-04 16:18:23,0 days 05:31:07.946608000,8
57,133,[UK] Rapist vaults over dock and flees court after guilty verdict,self.worldnews,2018-10-04 16:17:53,0 days 05:31:37.946608000,184
58,6,Selfie deaths: 259 people reported dead seeking the perfect picture,theguardian.com,2018-10-04 16:15:28,0 days 05:34:02.946609000,8
59,4,U.S. indicts seven Russians for hacking nuclear company Westinghouse,bbc.com,2018-10-04 16:05:02,0 days 05:44:28.946609000,10
60,3,U.S. not invited to save-the-WTO summit in Ottawa,reuters.com,2018-10-04 16:03:09,0 days 05:46:21.946610000,2
61,8,Imran Khan orders converting of the PM House into a post-grad research university,ctvnews.ca,2018-10-04 15:49:02,0 days 06:00:28.946610000,5
62,7,U.S. not invited to Canada’s upcoming trade meeting — only ‘like minded’ nations allowed,thenews.com.pk,2018-10-04 15:43:23,0 days 06:06:07.946610000,0
63,54900,New Zealand fines travelers who won't unlock secure devices,globalnews.ca,2018-10-04 15:41:09,0 days 06:08:21.946611000,4660
64,21,"Mexico: Over 9,000 Children Disappeared Amid Violent Security Policy",apnews.com,2018-10-04 15:36:19,0 days 06:13:11.946611000,19
65,8,Unilad publisher goes into administration,telesurtv.net,2018-10-04 15:33:25,0 days 06:16:05.946611000,4
66,0,US charges seven Russian spies over cyber-hacking,bbc.co.uk,2018-10-04 15:30:48,0 days 06:18:42.946612000,0
67,18,"In the short-term, wind power could hike global warming, new study says",theguardian.com,2018-10-04 15:27:46,0 days 06:21:44.946612000,4
68,0,Special counsel's office has radio interviews between Roger Stone and alleged WikiLeaks 'back channel',cosmosmagazine.com,2018-10-04 15:26:57,0 days 06:22:33.946612000,4
69,9,US charges 7 Russian intel officers as West condemns GRU,edition.cnn.com,2018-10-04 15:26:16,0 days 06:23:14.946613000,0
70,10,Taiwanese fishing boat fined for illegal shark catch,apnews.com,2018-10-04 15:19:06,0 days 06:30:24.946613000,1
71,18,Russian man identified in Dutch hacking probe played in 'Spy Football Team',focustaiwan.tw,2018-10-04 15:17:17,0 days 06:32:13.946614000,2
72,12,Puerto Ricans suing power company for overbilling get boost in court,themoscowtimes.com,2018-10-04 15:13:17,0 days 06:36:13.946614000,1
73,24,India plans facial recognition technology at airports,cbsnews.com,2018-10-04 15:09:39,0 days 06:39:51.946614000,0
74,6,Ireland rejects Dublin city proposal to house homeless on cruise ship,reuters.com,2018-10-04 15:06:57,0 days 06:42:34.662579000,2
75,5,Italian 'Robin Hood' banker sentenced over €1m pilfered for the poor,bbc.com,2018-10-04 15:05:12,0 days 06:44:19.662583000,0
76,18,"UK, Dutch accuse 'pariah state' Russia of hacking chemical watchdog",reuters.com,2018-10-04 15:04:08,0 days 06:45:23.662583000,1
77,5,Nepal bans online porn as outrage builds over shocking violence against women and girls - Critics slam government’s response to sexual violence as ‘diversionary tactic’,scmp.com,2018-10-04 14:58:44,0 days 06:50:47.662584000,1
78,5,Drew Barrymore: 'Surreal' article defended by EgyptAir,bbc.com,2018-10-04 14:57:41,0 days 06:51:50.662584000,0
79,102,Chinese Spying Chips Found Hidden On Servers Used By US Companies,thehackernews.com,2018-10-04 14:56:56,0 days 06:52:35.662584000,31
80,19,"Record 37,113 children suspected to have suffered abuse in Japan in first half of 2018 - The agency believes the figures do not necessarily indicate there is a general increase in abuse, but rather that people are reporting more suspected cases to authorities amid heightened public awareness.",japantimes.co.jp,2018-10-04 14:55:58,0 days 06:53:33.662585000,0
81,4,"Russia's Vladimir Putin Arrives In India, Focus On S-400 Missile Deal",ndtv.com,2018-10-04 14:53:57,0 days 06:55:34.662585000,0
82,9,"Registered charities may not survive unless they behave with greater selflessness and stop the slide in public trust, Tina Stowell, chair of the UK Charity Commission is warning.",theguardian.com,2018-10-04 14:51:18,0 days 06:58:13.662585000,3
83,5,"58,000 pregnancy tests sold in UK recalled",news.sky.com,2018-10-04 14:51:09,0 days 06:58:22.662586000,2
84,3,Justice Department announces indictments of 7 Russian spies,usatoday.com,2018-10-04 14:43:58,0 days 07:05:33.662586000,2
85,45,"1,000 earthquake and tsunami victims still missing in Indonesia",news.sky.com,2018-10-04 14:39:55,0 days 07:09:36.662586000,2
86,0,Justice Dept. indicts 7 Russian intelligence officers in international hacking scheme,cnn.com,2018-10-04 14:39:14,0 days 07:10:17.662587000,0
87,15,U.S. service member killed in Afghanistan: NATO statement,reuters.com,2018-10-04 14:34:57,0 days 07:14:34.662587000,0
88,49,West accuses Russia of global cyber plots,bbc.com,2018-10-04 14:33:47,0 days 07:15:44.662587000,11
89,6,Congo accuses EU of election interference for maintaining sanctions,reuters.com,2018-10-04 14:32:37,0 days 07:16:54.662588000,1
90,5,"Japan's new education minister slammed for advocating classes based on 'militarist' Imperial Rescript: Kazuo Shii, head of the Japanese Communist Party, told reporters,“The core of the rescript is the part urging people to give up their lives for the Emperor,and (Shibayama) doesn’t understand this.”",japantimes.co.jp,2018-10-04 14:30:32,0 days 07:18:59.662588000,0
91,148,Western nations accuse Russian intelligence of 'brazen' global cybercrimes,timesofisrael.com,2018-10-04 14:26:57,0 days 07:22:34.662588000,16
92,26,Russia claims US running biological weapons lab in Georgia,apnews.com,2018-10-04 14:12:50,0 days 07:36:41.662589000,35
93,8,Disgraced Chinese tycoon building Angola’s new airport,africanews.com,2018-10-04 14:10:11,0 days 07:39:20.662589000,1
94,3,Muslim Council of Britain to train women to run mosques - Six-month programme aims to increase diversity and follows calls for greater involvement,theguardian.com,2018-10-04 14:07:11,0 days 07:42:20.662589000,0
95,34,An Iraqi Instagram star who was shot dead on the streets of Baghdad is one of a string of similar deaths,thisisinsider.com,2018-10-04 14:02:17,0 days 07:47:14.662590000,7
96,12,Petrobras to pay $853.2m fine to settle Car Wash corruption scandal - oil company settles FCPA violations to U.S. and Brazil,hydrocarbons-technology.com,2018-10-04 13:58:55,0 days 07:50:36.662590000,1
97,45,U.S. Charges Russian GRU Officers with International Hacking and Related Influence and Disinformation Operations | OPA,justice.gov,2018-10-04 13:55:47,0 days 07:53:44.662590000,11
98,9,"Ukraine, Hungary expel consuls as passport row deepens",reuters.com,2018-10-04 13:48:23,0 days 08:01:08.662591000,1
99,3,Russia 'targeted chemical weapons body',bbc.com,2018-10-04 13:46:40,0 days 08:02:52.853134000,2
100,196,Science confirms what the heart already knows: Hugs really do make you feel better,edition.cnn.com,2018-10-04 13:45:21,0 days 08:04:11.853138000,30
101,298,Seven Russian intelligence officers indicted on conspiracy charges,thehill.com,2018-10-04 13:44:57,0 days 08:04:35.853139000,11
102,4,Russia accused of cyber-attack on chemical weapons watchdog,theguardian.com,2018-10-04 13:42:43,0 days 08:06:49.853139000,2
103,12,The Latest: US charges 7 Russian intel officers with hacking,abcnews.go.com,2018-10-04 13:40:47,0 days 08:08:45.853140000,6
104,4,U.S. indicts Russian spies in hacking campaign linked to Olympics doping scandal,washingtonpost.com,2018-10-04 13:38:06,0 days 08:11:26.853141000,2
105,11,Russia accused of cyber-attacks on chemical weapons body and Porton Down,theguardian.com,2018-10-04 13:37:17,0 days 08:12:15.853141000,0
106,294,BP paid off Mexican government with $25 million after major oil spill,mexiconewsdaily.com,2018-10-04 13:34:23,0 days 08:15:09.853142000,11
107,8,Saudi Arabia's consulate in Istanbul insists a prominent journalist critical of the Saudi government had already left its building before he vanished. The US state department has also requested information about Khashoggi's whereabouts and expressed concern about his safety.,bbc.com,2018-10-04 13:32:12,0 days 08:17:20.853142000,2
108,163,Russian-Canadian Pussy Riot member says he believes he was poisoned by Russian operatives,theglobeandmail.com,2018-10-04 13:31:19,0 days 08:18:13.853143000,29
109,129,Climate scientists are struggling to find the right words for very bad news,washingtonpost.com,2018-10-04 13:29:07,0 days 08:20:25.853144000,75
110,3,"Canada's international trade minister quietly sounded out officials at the Department of National Defence last spring about how much of the content in the navy's new Arctic Offshore Patrol Ships could be sourced back to China, newly released documents reveal.",cbc.ca,2018-10-04 13:27:29,0 days 08:22:03.853144000,2
111,35,GRU Busted Trying to Hack Chemical Weapons Agency to Foil Investigation of Russian Operations,thedailybeast.com,2018-10-04 13:26:14,0 days 08:23:18.853145000,0
112,1,"Bumper to slumper: New emissions tests choke UK car sales - UK sales of new cars plunged by a fifth in September as new emissions tests caused delivery backlogs, while waning appetite for diesel cars and weaker consumer confidence weighed on demand.",theguardian.com,2018-10-04 13:24:17,0 days 08:25:15.853145000,3
113,219,Christopher Wylie says he was pushed into traffic and assaulted after exposing Facebook's bombshell data scandal,businessinsider.com,2018-10-04 13:22:54,0 days 08:26:38.853146000,31
114,31,"Sexual assault still underreported at Munich Oktoberfest - Oktoberfest is known around the world for its beer, pretzels and lederhosen. But female visitors frequently find themselves the targets of harassment and groping. Some even say it has become predictable.",dw.com,2018-10-04 13:22:37,0 days 08:26:55.853146000,13
115,3,India tops list of migrants living abroad at 17 million: UN,thehindubusinessline.com,2018-10-04 13:19:21,0 days 08:30:11.853147000,2
116,4,"Using Tactics Perfected By Trump, Populist And Nationalist Leaders Are Undermining Italy’s Institutions",buzzfeednews.com,2018-10-04 13:18:50,0 days 08:30:42.853148000,2
117,13,Canadian dairy farmers get `Slap in the Face' from new NAFTA,farmfutures.com,2018-10-04 13:13:19,0 days 08:36:13.853148000,10
118,8,Top EU officials deplore Russian cyber attack on chemical weapons body,reuters.com,2018-10-04 13:11:01,0 days 08:38:31.853149000,0
119,47,GRU Busted Trying to Hack Chemical Weapons Agency to Foil Investigation of Russian Operations,thedailybeast.com,2018-10-04 13:09:44,0 days 08:39:48.853149000,4
120,6,"crude oil price: Oil slips as Saudi and Russia quietly agree output rise, US stocks swell",economictimes.indiatimes.com,2018-10-04 13:07:50,0 days 08:41:42.853150000,2
121,0,Damon Wayans says he is quitting 'Lethal Weapon',eu.usatoday.com,2018-10-04 13:07:22,0 days 08:42:10.853150000,4
122,11,Dutch officials say they caught Russian spies targeting chemical weapons body,edition.cnn.com,2018-10-04 13:04:34,0 days 08:44:58.853151000,0
123,0,'KILLED FOR FUN' Fury as FTSE 100 mining boss and conservation charity patron poses with dead elephant and leopard on ‘trophy hunting’ trips,thesun.co.uk,2018-10-04 13:03:58,0 days 08:45:34.853151000,3
124,6,Saudi critic missing after entering Istanbul consulate,edition.cnn.com,2018-10-04 13:02:40,0 days 08:46:53.587175000,3
125,2,First Moon in a Distant Star System Discovered Around Exoplanet Kepler-1625b.,astronomy.com,2018-10-04 13:02:34,0 days 08:46:59.587179000,0
126,3,China calls US ‘irresponsible’ for suggesting Beijing cancelled security talks,scmp.com,2018-10-04 12:58:01,0 days 08:51:32.587180000,2
127,2,Taiwan accuses Beijing of trying to make it ‘irrelevant’ with Vatican deal,scmp.com,2018-10-04 12:57:36,0 days 08:51:57.587180000,0
128,6,U.S. warns of new hacking spree from group linked to Beijing after lull,japantimes.co.jp,2018-10-04 12:56:44,0 days 08:52:49.587180000,3
129,5,Toyota and SoftBank to integrate mobility and AI in new venture,japantimes.co.jp,2018-10-04 12:55:40,0 days 08:53:53.587181000,0
130,3,Indonesian President Calls on Taliban to End War,tolonews.com,2018-10-04 12:54:38,0 days 08:54:55.587181000,2
131,0,Afghan Govt Says No To ‘Private and Profit Driven’ War,tolonews.com,2018-10-04 12:54:15,0 days 08:55:18.587182000,1
132,6,Ukraine expels Hungarian consul after passport row,english.ahram.org.eg,2018-10-04 12:52:30,0 days 08:57:03.587182000,1
133,3,Bahrain begins trial of Hezbollah suspects,middleeastmonitor.com,2018-10-04 12:51:07,0 days 08:58:26.587182000,0
134,60,"PA prevents Gaza from receiving Qatari fuel aid, increasing danger of violence",timesofisrael.com,2018-10-04 12:49:48,0 days 08:59:45.587183000,30
135,3,Honda to invest in GM's autonomous vehicle unit,dailysabah.com,2018-10-04 12:49:25,0 days 09:00:08.587183000,0
136,0,Turkey's Foreign Ministry summons Saudi ambassador over missing journalist,dailysabah.com,2018-10-04 12:48:48,0 days 09:00:45.587183000,0
137,0,Saudis insist missing Post contributor left Istanbul Consulate,hurriyetdailynews.com,2018-10-04 12:48:23,0 days 09:01:10.587184000,1
138,0,Putin: Sergei Skripal is a scumbag and traitor who betrayed Russia,edition.cnn.com,2018-10-04 12:46:47,0 days 09:02:46.587184000,1
139,63,Abbas Planning to Impose Additional Sanctions on Gaza,algemeiner.com,2018-10-04 12:46:23,0 days 09:03:10.587184000,8
140,2,Gulag Historian Detained on Pedophilia Charges,themoscowtimes.com,2018-10-04 12:45:38,0 days 09:03:55.587185000,1
141,6,Shots Fired at Protest in Russia's North Caucasus Over Land Swap Deal,themoscowtimes.com,2018-10-04 12:45:21,0 days 09:04:12.587185000,0
142,58,Bavaria One: German state to launch its own space program,dw.com,2018-10-04 12:44:52,0 days 09:04:41.587185000,10
143,53,Dogs in Netherlands must have passports by 2020,dutchnews.nl,2018-10-04 12:44:05,0 days 09:05:28.587186000,23
144,5,EU business lobby to champion climate status quo – leak,euractiv.com,2018-10-04 12:39:08,0 days 09:10:25.587186000,0
145,0,'Rolls-Royce' of whisky fetches record $1 million at auction,dw.com,2018-10-04 12:33:30,0 days 09:16:03.587186000,4
146,262,"""Selfie deaths"" on the rise worldwide.",bbc.co.uk,2018-10-04 12:26:53,0 days 09:22:40.587187000,152
147,0,Dozens of Georgians likely killed by US toxin or bioweapon disguised as drug research – Russian MoD,rt.com,2018-10-04 12:16:39,0 days 09:32:54.587187000,39
148,33,False widow spider infestations close 4 east London schools - Schools could be closed for up to 3 weeks while non-deadly spiders are dealt with,theguardian.com,2018-10-04 12:14:52,0 days 09:34:41.587187000,15
149,16,Merkel at Yad Vashem: Holocaust a crime unlike any other,ynetnews.com,2018-10-04 12:12:53,0 days 09:36:41.371437000,1
150,85,Japan's Board of Audit says the government has already spent more than 5 times the original estimate on projects related to the 2020 Tokyo Olympics and Paralympics.,nhk.or.jp,2018-10-04 12:11:58,0 days 09:37:36.371440000,21
151,0,"Marijuana may be worse for teen brains than alcohol, study finds",nbcnews.com,2018-10-04 12:11:32,0 days 09:38:02.371441000,26
152,3,Indonesia tsunami: crisis worsens as aid struggles to reach island | World news,theguardian.com,2018-10-04 12:09:47,0 days 09:39:47.371441000,1
153,2586,"""Stop arresting those who insult me"" says, Prime Minister of Malaysia, Dr Mahathir to police officers",malaysiakini.com,2018-10-04 12:03:38,0 days 09:45:56.371441000,62
154,6,Tasmanian Greens leader accused of 'racist dog-whistling' as party split over China,theguardian.com,2018-10-04 12:00:32,0 days 09:49:02.371442000,6
155,8,Russia accused of cyber-attacks on chemical weapons body and Porton Down | World news,theguardian.com,2018-10-04 11:59:37,0 days 09:49:57.371442000,3
156,1753,"Catholic Priests in Chile Had to Be Told Not to Touch Children - A new directive issued to priests in Chile orders them not to touch, fondle, or lie naked with children—which explains a lot about why clerical sex abuse is still a problem.",thedailybeast.com,2018-10-04 11:57:47,0 days 09:51:47.371443000,165
157,20,"UK's MI5 agents have been granted legal immunity to participate in murder, torture, sexual assaults and other criminality, a tribunal has heard.",theguardian.com,2018-10-04 11:56:48,0 days 09:52:46.371443000,13
158,9,Russia 'targeted chemical weapons body',bbc.co.uk,2018-10-04 11:48:37,0 days 10:00:57.371443000,1
159,13,"Norway Extends Detention of Russian Suspected of Spying: A court in Norway extended the detention of a Russian citizen suspected of spying at the Norwegian parliament for another two weeks on Thursday, despite Moscow's protests.",themoscowtimes.com,2018-10-04 11:43:56,0 days 10:05:38.371444000,1
160,1851,"Chinese spy chips are found in hardware used by Apple, Amazon, Bloomberg says; Apple, AWS say no way",cnbc.com,2018-10-04 11:43:46,0 days 10:05:48.371444000,375
161,0,World chess gets first new president in two decades as Putin loyalist takes power,telegraph.co.uk,2018-10-04 11:36:38,0 days 10:12:56.371444000,1
162,68,Danske Bank faces US investigation into money-laundering,theguardian.com,2018-10-04 11:35:48,0 days 10:13:46.371445000,4
163,4,US threatens to 'take out' Russian missiles if Moscow keeps violating nuclear treaty,edition.cnn.com,2018-10-04 11:23:42,0 days 10:25:52.371445000,6
164,54,Netherland authorities accuse Russia of targeting OPCW and MH17 investigation,edition.cnn.com,2018-10-04 11:22:54,0 days 10:26:40.371445000,5
