,upvotes,title,site,time_posted,post_age,comment_no
328,21,"Peru court overturns pardon of ex-dictator Fujimori, who was sentenced to 25 of jail time in 2009 for crimes against humanity and then received a controversial humanitarian pardon the 24th of december of 2017.",theguardian.com,2018-10-03 18:29:26,1 days 03:23:45.079845000,1
329,15,Putin calls poisoned ex-spy Skripal a scumbag and traitor,reuters.com,2018-10-03 18:23:52,1 days 03:29:19.079845000,8
330,92,Astronomers Find First Evidence of Possible Moon Outside Our Solar System,hubblesite.org,2018-10-03 18:17:51,1 days 03:35:20.079845000,8
331,11,Attack on ICRC Ebola ambulance in Congo wounds three volunteers,mobile.reuters.com,2018-10-03 18:14:49,1 days 03:38:22.079846000,2
332,119,U.S. withdrawing from Vienna protocol on dispute resolution: Bolton,reuters.com,2018-10-03 18:00:34,1 days 03:52:37.079846000,27
333,21,"France says Iran behind foiled bomb plot near Paris, seizes assets in retaliation",news18.com,2018-10-03 17:58:51,1 days 03:54:20.079847000,10
334,385,Indigenous Chileans Win Back Land From Logging Company,telesurtv.net,2018-10-03 17:56:37,1 days 03:56:34.079847000,4
335,11,Volcano erupts on Indonesia's quake and tsunami-hit Sulawesi,nbcnews.com,2018-10-03 17:54:48,1 days 03:58:23.079847000,1
336,1,"Calgarians slog through streets after heavy, wet snowfall",theglobeandmail.com,2018-10-03 17:51:18,1 days 04:01:53.079848000,5
337,11,Family of 3 killed in Saudi-led airstrike on Yemen's Hajjah province,xinhuanet.com,2018-10-03 17:50:29,1 days 04:02:42.079848000,2
338,3,Guinea-Bissau migrant shipwreck: Dozens feared dead,bbc.co.uk,2018-10-03 17:48:01,1 days 04:05:10.079848000,0
339,43,Putin signs bill that raises pension age in Russia,heraldcourier.com,2018-10-03 17:46:12,1 days 04:06:59.079849000,14
340,142,India risks U.S. sanctions with $5-billion purchase of Russian missiles,reuters.com,2018-10-03 17:45:56,1 days 04:07:15.079849000,55
341,48,"Middle-aged drinkers should have alcohol-free days, urges Public Health England",independent.co.uk,2018-10-03 17:40:05,1 days 04:13:06.079849000,23
342,8,(UK aka 1st world country) Cumbria slavery probe: Man 'lived in shed (as a slave) for 40 years',bbc.co.uk,2018-10-03 17:38:37,1 days 04:14:34.079850000,4
343,57,"Russian President Vladimir Putin denied involvement in the poisoning of ex-spy Sergei Skripal: “He was simply a spy. A traitor to the motherland..He’s simply a scumbag, that’s all.""",politico.eu,2018-10-03 17:32:52,1 days 04:20:19.079850000,7
344,5118,Putin Tells Trump: 'Blame the Guy in the Mirror for High Oil Prices',themoscowtimes.com,2018-10-03 17:32:37,1 days 04:20:34.079850000,472
345,15,"Authorities in Indonesia are ""planning arrests"" as they fight fake news about the aftermath of the earthquake and tsunami that have killed more than 1,400 people",bbc.co.uk,2018-10-03 17:23:10,1 days 04:30:01.079851000,3
346,47,Pakistan needs to raise $20b to avoid payment crisis,tribune.com.pk,2018-10-03 17:20:40,1 days 04:32:31.079851000,14
347,30,Foreign Minister: Four Million Venezuelans May Live in Colombia by 2021,voanews.com,2018-10-03 17:16:38,1 days 04:36:33.079851000,6
348,12,Fan Bingbing: missing Chinese actor hit with $129m tax bill,theguardian.com,2018-10-03 17:09:36,1 days 04:43:35.079852000,5
349,9,Pakistan: Balochistan considering making Chinese language compulsory in matric,pakistantoday.com.pk,2018-10-03 17:09:08,1 days 04:44:03.586195000,2
350,3,"Pompeo pulls out of treaty with Iran, in response to UN court ruling",foxnews.com,2018-10-03 17:04:26,1 days 04:48:45.586199000,6
351,7,"French gangster, who once hid in Israel as an Orthodox Jew, captured after cops spotted 'man' in burqa",haaretz.com,2018-10-03 16:59:59,1 days 04:53:12.586199000,4
352,1,Stubb: A Macron-style candidate against the conservative Weber for the next president of the European Commission,euractiv.com,2018-10-03 16:59:23,1 days 04:53:48.586199000,1
353,21,Pompeo announces termination of 1955 treaty with Iran after sanctions ruling,cbsnews.com,2018-10-03 16:58:51,1 days 04:54:20.586200000,1
354,0,"Fork Over Passwords or Pay the Price, New Zealand Tells Travelers",nytimes.com,2018-10-03 16:47:25,1 days 05:05:46.586200000,3
355,6,"United States called off top security talks, China says",politico.com,2018-10-03 16:46:12,1 days 05:06:59.586201000,7
356,5,Putin says Trump should blame himself for high oil prices,cnbc.com,2018-10-03 16:44:46,1 days 05:08:25.586201000,5
357,7,Saudi Woman Not Allowed To Marry Man For Playing Musical Instrument,telesurtv.net,2018-10-03 16:44:38,1 days 05:08:33.586201000,30
358,27,Europe's politicians agree to cut car CO2 by 40%,euractiv.com,2018-10-03 16:38:24,1 days 05:14:47.586202000,7
359,0,Turkey says U.S. stalling in Syria's Manbij is a 'growing problem',reuters.com,2018-10-03 16:38:01,1 days 05:15:10.586202000,0
360,1,Putin labels ex-spy Skripal a 'scumbag',bbc.com,2018-10-03 16:30:06,1 days 05:23:05.586202000,0
361,26,Bill Gates says India shining a light on sanitation,hindustantimes.com,2018-10-03 16:19:54,1 days 05:33:17.586203000,12
362,0,Bionomics’ Phase 2 Post Traumatic Stress Disorder Trial Results,pipelinereview.com,2018-10-03 16:17:59,1 days 05:35:12.586203000,1
363,3453,"World economy at risk of another financial crash, says IMF",theguardian.com,2018-10-03 16:14:47,1 days 05:38:24.586203000,853
364,4,Amazon CEO Jeff Bezos tops Bill Gates on Forbes richest Americans list,usatoday.com,2018-10-03 16:09:33,1 days 05:43:38.586204000,5
365,76,EBay accuses Amazon of 'unlawful' merchant poaching,cnbc.com,2018-10-03 16:06:38,1 days 05:46:33.586204000,35
366,131,Canada revokes honorary citizenship of Aung San Suu Kyi over inaction on military violence against Myanmar's Rohingya Muslims,aljazeera.com,2018-10-03 16:06:14,1 days 05:46:57.586204000,11
367,0,UN court orders US to lift some Iran sanctions,apnews.com,2018-10-03 16:04:23,1 days 05:48:48.586205000,17
368,127,"Venezuela: nearly 2m people have fled country since 2015, UN says",theguardian.com,2018-10-03 16:00:18,1 days 05:52:53.586205000,81
369,7,U.S. working to halt spread of diseases from Venezuela,reuters.com,2018-10-03 15:59:48,1 days 05:53:23.586205000,2
370,7,Australia ends controversial 'tampon tax',bbc.com,2018-10-03 15:58:38,1 days 05:54:33.586206000,0
371,6,"Saudi Arabia, Russia agreed in Sept to lift oil output, told U.S.",reuters.com,2018-10-03 15:57:12,1 days 05:55:59.586206000,1
372,6,Chinese fiscal authorities are taking action against actress accused of tax evasion,time.com,2018-10-03 15:52:47,1 days 06:00:24.586206000,0
373,9,Pompeo says Iran is origin of threat to U.S. missions in Iraq,reuters.com,2018-10-03 15:42:00,1 days 06:11:11.586207000,8
374,42,Donald Trump: Saudi Arabia's king wouldn't last 2 weeks without US military support - Times of India,timesofindia.indiatimes.com,2018-10-03 15:36:58,1 days 06:16:14.301711000,40
375,4,"Vietnam nominates party chief as new president - The current Communist Party's General Secretary will serve as President after the ""mysterious"" death of former President Tran Dai Quang",channelnewsasia.com,2018-10-03 15:26:08,1 days 06:27:04.301716000,1
376,1,The Thailand cave rescue points the way to a more unified global future,theguardian.com,2018-10-03 15:24:24,1 days 06:28:48.301716000,2
377,106,France said on Tuesday there was no doubt Iran’s intelligence ministry was behind a June plot to attack an exiled opposition group’s rally outside Paris and it seized assets belonging to Tehran’s intelligence services and two Iranian nationals.,reuters.com,2018-10-03 15:18:36,1 days 06:34:36.301717000,27
378,300,A Peter Thiel-backed startup has raised $25 million to unleash a 'virgin market of for-profit psychedelic research',businessinsider.com,2018-10-03 15:08:52,1 days 06:44:20.301717000,87
379,13,Ireland does not want border down the Irish Sea: minister,reuters.com,2018-10-03 14:53:57,1 days 06:59:15.301718000,2
380,44,"Nobel in Chemistry awarded for invention of ""directed evolution"" of enzymes, which intentionally allows mutations in order for enzymes to ""evolve"" new and more effective variants.",cnn.com,2018-10-03 14:53:54,1 days 06:59:18.301718000,4
381,9,"Amid currency's freefall, Yemen receives cash injection",abcnews.go.com,2018-10-03 14:46:38,1 days 07:06:34.301718000,4
382,1,Putin says all foreign troops should leave Syria after war,timesofisrael.com,2018-10-03 14:41:13,1 days 07:11:59.301719000,8
383,13800,"Teen Iranian girl who alleged rape by brother-in-law, abuse by husband executed after 'grossly unfair trial'",newsweek.com,2018-10-03 14:39:55,1 days 07:13:17.301719000,1376
384,208,Silvio Berlusconi Will Probably Skip His Own Party’s Conference And Go To Vladimir Putin’s Birthday Party Instead,buzzfeednews.com,2018-10-03 14:38:19,1 days 07:14:53.301719000,21
385,1,Theresa May's Dancing Queen conference stage arrival,bbc.co.uk,2018-10-03 14:30:53,1 days 07:22:19.301720000,1
386,18,Australian industry and tech groups unite to fight encryption-busting Bill,zdnet.com,2018-10-03 14:30:03,1 days 07:23:09.301720000,0
387,9,Photos show how close Chinese warship came to colliding with US destroyer,cnn.com,2018-10-03 14:28:19,1 days 07:24:53.301720000,23
388,10,Two Gazans arrested crossing into Israel,timesofisrael.com,2018-10-03 14:06:02,1 days 07:47:10.301721000,24
389,48,"Blocked in a car by a mob, kept from their HQ: Why UNRWA staff had to flee Gaza",timesofisrael.com,2018-10-03 14:04:07,1 days 07:49:05.301721000,3
390,6,"Russia's Putin calls poisoned ex-spy scumbag, traitor",apnews.com,2018-10-03 13:54:25,1 days 07:58:47.301721000,8
391,6,'I saw my neighbours get buried alive': the mud-swamped Indonesian village | World news,theguardian.com,2018-10-03 13:46:45,1 days 08:06:27.301722000,7
392,20,US to offer cyberwar capabilities to NATO allies,apnews.com,2018-10-03 13:44:42,1 days 08:08:30.301722000,7
393,5,UN court orders US to lift sanctions on Iran tied to humanitarian efforts,politico.eu,2018-10-03 13:40:28,1 days 08:12:44.301722000,2
394,5,Yemeni officials: Houthi militias release slain ex-president’s sons,arabnews.com,2018-10-03 13:39:31,1 days 08:13:41.301723000,0
395,7,Notorious French gangster Redoine Faid caught three months after helicopter escape from prison,nydailynews.com,2018-10-03 13:36:02,1 days 08:17:10.301723000,1
396,17,Spain court confirms jail sentence for former IMF chief Rato,reuters.com,2018-10-03 13:35:21,1 days 08:17:51.301724000,0
397,10,Trump: I told Saudi king he wouldn't last without U.S. support,reuters.com,2018-10-03 13:33:50,1 days 08:19:22.301724000,17
398,6,"Pressure from the health department prompted the parliamentary library to remove then amend advice issued in June that contradicted the health minister Greg Hunt’s assurances about police access to My Health Records, new correspondence reveals",theguardian.com,2018-10-03 13:32:28,1 days 08:20:44.301724000,0
399,0,Putin: Skripal is traitor and scum,en.crimerussia.com,2018-10-03 13:27:40,1 days 08:25:33.345628000,1
400,0,Putin calls Sergey Skripal a ‘scumbag’ and a ‘traitor to his homeland’,meduza.io,2018-10-03 13:26:11,1 days 08:27:02.345632000,1
401,8,'I saw my neighbours get buried alive': the mud-swamped Indonesian village,theguardian.com,2018-10-03 13:25:33,1 days 08:27:40.345633000,2
402,5,Skripal poisoning: Putin denounces ex-spy as 'scum',bbc.co.uk,2018-10-03 13:24:10,1 days 08:29:03.345633000,0
403,0,Vladimir Putin calls Sergei Skripal a scumbag and a traitor,theguardian.com,2018-10-03 13:07:53,1 days 08:45:20.345633000,7
404,17,Vladimir Putin calls Sergei Skripal a scumbag and a traitor,theguardian.com,2018-10-03 13:07:41,1 days 08:45:32.345634000,5
405,401,"Putin calls poisoned former agent Sergei Skripal a ""traitor""",axios.com,2018-10-03 13:06:54,1 days 08:46:19.345634000,60
406,59700,"A Saudi woman has lost a judicial battle to marry the man of her choice as a court deemed him ""religiously"" unfit because he plays a musical instrument, a Saudi newspaper reports",yahoo.com,2018-10-03 13:05:50,1 days 08:47:23.345634000,3083
407,7,Vietnam nominates party chief as new president,reuters.com,2018-10-03 13:04:38,1 days 08:48:35.345635000,2
408,9,Japan space probe launches new robot onto asteroid,straitstimes.com,2018-10-03 13:04:08,1 days 08:49:05.345635000,2
409,13,Putin says ex-spy poisoned in UK had betrayed the motherland,reuters.com,2018-10-03 12:57:04,1 days 08:56:09.345636000,4
410,1,Putin says better if Trump didn't intervene in oil markets,reuters.com,2018-10-03 12:48:33,1 days 09:04:40.345636000,2
411,2,NATO ambassador clarifies: 'I was not talking about preemptively striking Russia',washingtonexaminer.com,2018-10-03 12:40:49,1 days 09:12:24.345636000,8
412,18,Fake News Comes to Academia - Three scholars gulled academic journals to publish hoax papers on ‘grievance studies.’,wsj.com,2018-10-03 12:39:55,1 days 09:13:18.345637000,4
413,4,Polish church turns to top court in pedophile case,reuters.com,2018-10-03 12:38:09,1 days 09:15:04.345637000,0
414,10,Putin says he wants all foreign forces to eventually quit Syria,reuters.com,2018-10-03 12:22:44,1 days 09:30:29.345637000,18
415,3,Moscow: Man in Geländewagen threatens to blow himself up near the walls of Kremlin,en.crimerussia.com,2018-10-03 12:22:33,1 days 09:30:40.345638000,2
416,12,"Theresa May among millions facing drug shortages in event of no-deal Brexit, says medicines chief",heraldscotland.com,2018-10-03 12:14:21,1 days 09:38:52.345638000,5
417,10,The British Prime Minister just danced onto the stage for her keynote speech,independent.co.uk,2018-10-03 12:05:32,1 days 09:47:41.345638000,18
418,8,Toys R Us brand comeback in works,cbsnews.com,2018-10-03 11:56:41,1 days 09:56:32.345639000,6
419,11,Catalan leader threatens to bring down Spanish government,irishtimes.com,2018-10-03 11:52:43,1 days 10:00:30.345639000,4
420,4,India sends seven Rohingya to border to be deported to Myanmar,reuters.com,2018-10-03 10:09:14,1 days 11:43:59.345639000,0
421,70,Saudi critic vanishes in Istanbul,bbc.com,2018-10-03 11:49:10,1 days 10:04:03.345640000,9
422,13,"U.N. court says U.S. must lift Iran sanctions on ""humanitarian"" goods",cbsnews.com,2018-10-03 11:47:32,1 days 10:05:41.345640000,2
423,45,"The 2018 Nobel Prize in Chemistry has been awarded to Drs. Frances Arnold, George P Smith and Gregory Winter for their discoveries in enzyme research which has impacted fields ranging from drug discovery to the development of cleaner fuels.",bbc.com,2018-10-03 11:45:38,1 days 10:07:35.345640000,7
424,61,"Chinese actress Fan Bingbing released, will escape criminal prosecution if she pays US$130 million for tax offenses",china-underground.com,2018-10-03 11:41:12,1 days 10:12:01.963834000,11
425,225,Osaka severs ties with sister-city San Francisco over 'comfort women' statue,japantimes.co.jp,2018-10-03 11:36:46,1 days 10:16:27.963839000,190
426,2,Daesh announces death of senior militant in Sinai,middleeastmonitor.com,2018-10-03 11:34:49,1 days 10:18:24.963839000,0
427,55,‘We Are Not Here to Manage Capitalism’: Labour Takes a Socialist Turn,thenation.com,2018-10-03 11:27:59,1 days 10:25:14.963840000,81
428,119,"Brexit is 'tragedy', Danish government will 'look after' Brits in Denmark: PM - Prime Minister Lars Løkke Rasmussen has moved to reassure British nationals living in Denmark over their future status in the country.",thelocal.dk,2018-10-03 11:23:12,1 days 10:30:01.963840000,18
429,0,Trump’s NATO Ambassador Threatens War With Russia ... By Mistake ... We Think,thedailybeast.com,2018-10-03 11:22:32,1 days 10:30:41.963840000,10
430,11000,'Tampon tax' scrapped in Australia after 18-year controversy: Tampons and sanitary pads were sold with a 10% goods and services tax because they were categorised as non-essential items,bbc.com,2018-10-03 11:19:22,1 days 10:33:51.963841000,1077
431,0,Toronto housing market’s hot rebound cools in September,theglobeandmail.com,2018-10-03 11:19:07,1 days 10:34:06.963841000,0
432,13,India launches ‘Operation Samudra Maitri’ to help tsunami-hit Indonesia,indianexpress.com,2018-10-03 11:18:55,1 days 10:34:18.963841000,2
433,0,Pompeo Discusses Regional Security During Trip to Pakistan,tolonews.com,2018-10-03 11:17:36,1 days 10:35:37.963842000,0
434,0,Abdullah Leaves for Two-Day Visit to Indonesia,tolonews.com,2018-10-03 11:17:15,1 days 10:35:58.963842000,0
435,359,"Japan's sei whale meat sales deemed to be in violation of Washington convention - After the session, a Japanese government source said it was regrettable that the country’s stance of putting emphasis on the importance of whaling for research purposes was not understood.",japantimes.co.jp,2018-10-03 11:16:47,1 days 10:36:26.963843000,54
436,6,Russian Billionaire Slaps Sotheby's with $380 Million Lawsuit,themoscowtimes.com,2018-10-03 11:16:46,1 days 10:36:27.963843000,1
437,71,"Extreme right is recruiting through social media, warns Dutch security services",dutchnews.nl,2018-10-03 11:15:38,1 days 10:37:35.963843000,52
438,4,Russia Government Works to Curb Dollar Use Amid Sanctions Fears,themoscowtimes.com,2018-10-03 11:14:43,1 days 10:38:30.963844000,3
439,51,Masked Palestinian ‘night confusion units’ step up anti-Israel unrest at Gaza border with fire balloons and sound bombs,scmp.com,2018-10-03 11:14:15,1 days 10:38:58.963844000,13
440,9,"Climate-induced sea-level rise to worsen tsunami impacts - In the wake of the latest tsunami to hit the Indonesian coast, research shows how even slight sea-level rises linked to climate change could significantly increase the devastating effects of tidal waves.",dw.com,2018-10-03 11:13:02,1 days 10:40:11.963844000,4
441,8,"Clinical trials of a new heart drug have been stopped in the UK because of concerns over Brexit. The department of health said it was confident the UK would continue to have the ""best possible environment"" for clinical trials.",bbc.com,2018-10-03 11:11:48,1 days 10:41:25.963845000,1
442,19,Deadly bacteria warning goes out to visitors of Berlin sex club,p.dw.com,2018-10-03 11:06:34,1 days 10:46:39.963845000,17
443,13,"Chinese actress Fan Bingbing released from secret detention, told to pay US$130 million for tax offences",m.scmp.com,2018-10-03 10:58:28,1 days 10:54:45.963845000,5
444,9,Saudi dissident Jamal Khashoggi 'missing after visit to consulate' | World news,theguardian.com,2018-10-03 10:57:19,1 days 10:55:54.963846000,1
445,699,"U.S. puts yakuza figures, companies on sanctions blacklist - The U.S. Treasury took aim Tuesday at Japan's largest yakuza organized crime syndicate, placing four senior officials of the Yamaguchi-Gumi on its sanctions blacklist as well as two companies tied to the gang.",japantoday.com,2018-10-03 10:54:15,1 days 10:58:58.963846000,93
446,212,The United Nation's Top Court Ordered the Trump Administration to Lift Sanctions on Iran,time.com,2018-10-03 10:53:51,1 days 10:59:22.963846000,55
447,37,"Don't delete your dealer's number yet — legal cannabis shortage looms - ""There is not currently enough legal supply of marijuana to actually supply all the recreational demand in Canada,"" said economist Rosalie Wyonch of the C.D. Howe Institute, a public policy think-tank.",cbc.ca,2018-10-03 10:50:50,1 days 11:02:23.963847000,20
448,0,Theresa May rocked by 'no confidence' letter ahead of crucial conference speech,rt.com,2018-10-03 10:48:30,1 days 11:04:43.963847000,0
449,89,The world’s biggest mining company has sought an injunction against Australia’s tax commissioner to force him to return documents it claims were obtained illegally in last year’s Paradise Papers leak.,theguardian.com,2018-10-03 10:46:10,1 days 11:07:04.556606000,9
450,6,"Pret a Manger has agreed to full ingredient labelling on all of its freshly made products following the case of Natasha Ednan-Laperouse, the teenager who died after having an allergic reaction to one of its baguettes.",theguardian.com,2018-10-03 10:40:05,1 days 11:13:09.556610000,3
451,80,"The French-German Mobile Asteroid Surface Scout (MASCOT) lander was released from an unmanned Japanese spacecraft on Wednesday. A few hours later, Japanese space agency JAXA confirmed that the scout hand landed on the Ryugu asteroid, 325 million kilometers (201 million miles) from earth.",dw.com,2018-10-03 10:38:01,1 days 11:15:13.556610000,2
452,3809,PepsiCo just became the latest beverage company to look at the fast-growing cannabis market,cnbc.com,2018-10-03 10:36:54,1 days 11:16:20.556611000,342
453,21,"China praises state TV reporter for 'slapping a Tory' at party conference - Kong Linlin, a nationalist reporter for China Central Television (CCTV), had earlier disrupted an event about political freedoms in the former British colony Hong Kong, and was eventually asked by delegates and MPs to leave.",independent.co.uk,2018-10-03 10:36:36,1 days 11:16:38.556611000,7
454,644,Chinese actress Fan Bingbing ordered to pay $129M in fines and back taxes for tax evasion,yahoo.com,2018-10-03 10:34:49,1 days 11:18:25.556612000,193
455,1,"After months of deadlock, Iraqis name new president and prime minister",washingtonpost.com,2018-10-03 10:21:56,1 days 11:31:18.556612000,1
456,19,"Rédoine Faïd, who escaped from prison via helicopter in July captured.",bbc.com,2018-10-03 10:20:53,1 days 11:32:21.556612000,2
457,466,"Suu Kyi, 'complicit in genocide', a Canadian citizen no more",presstv.com,2018-10-03 10:14:33,1 days 11:38:41.556613000,126
458,26,Canada officially revokes Aung San Suu Kyi’s honorary citizenship,scroll.in,2018-10-03 10:14:19,1 days 11:38:55.556613000,5
459,3,UN Chief Presents PM Modi With ‘Champions of Earth’ Award for Solar Push,news18.com,2018-10-03 10:04:53,1 days 11:48:21.556613000,0
460,3,Morocco's foreign minister rejects EU's migrant centers,dw.com,2018-10-03 10:04:51,1 days 11:48:23.556614000,1
461,1048,"Jamal Khashoggi, a prominent Saudi journalist known as a fierce critic of his country's policies, has vanished after visiting a Saudi consulate in Turkey",bbc.co.uk,2018-10-03 09:58:19,1 days 11:54:55.556614000,45
462,306,U.S. ordered to lift some Iran sanctions by International Court of Justice,nbcnews.com,2018-10-03 09:56:05,1 days 11:57:09.556614000,181
463,7,UN court issues interim order to US to lift some Iran sanctions,aljazeera.com,2018-10-03 09:38:57,1 days 12:14:17.556615000,2
464,2,US must lift humanitarian sanctions on Iran : UN Court,m.timesofindia.com,2018-10-03 09:34:44,1 days 12:18:30.556615000,13
465,33,"A Brazilian rightwing group led by a messianic cult leader who claimed to be in contact with aliens carried out terrorist acts to justify repression by the country’s military dictatorship, according to newly discovered archive documents.",theguardian.com,2018-10-03 09:34:36,1 days 12:18:38.556615000,2
466,8,Trump seeks to cut off and control funding of U.N. human rights programs,foreignpolicy.com,2018-10-03 08:56:52,1 days 12:56:22.556616000,0
467,6,Malaysia's anti-graft agency arrested former first lady Rosmah Mansor on Wednesday and she will be charged with money laundering.,reuters.com,2018-10-03 08:55:41,1 days 12:57:33.556616000,1
468,46,"A dead South Korean man who once praised North Korea founder Kim Il Sung while drinking has been found not guilty, more than 40 years after he was sent to prison.",upi.com,2018-10-03 08:48:53,1 days 13:04:21.556617000,7
469,5,"Aston Martin has made a disappointing stock market debut, with shares in the luxury carmaker dipping as low as £17.75 when trading got under way, having opened at £19.",amp.theguardian.com,2018-10-03 08:39:11,1 days 13:14:03.556617000,5
470,6,Budget battle: Italian populism takes on EU prudence,irishtimes.com,2018-10-03 08:34:36,1 days 13:18:38.556617000,0
471,2,Fan Bingbing: Missing Chinese actress fined for tax fraud,bbc.co.uk,2018-10-03 08:27:20,1 days 13:25:54.556618000,0
472,0,Instagram app and website down across globe,news.sky.com,2018-10-03 08:15:41,1 days 13:37:33.556618000,7
473,28,Robert Mueller's Russia Investigation Sheds Attorneys in Sign of a Narrowing Probe,time.com,2018-10-03 08:15:35,1 days 13:37:39.556618000,10
474,2,"Qatar's energy minister defends OPEC, says it has not manipulated oil prices",cnbc.com,2018-10-03 08:13:21,1 days 13:39:54.191639000,0
475,12,"Chinese warship made US destroyer 'slam on the brakes,' expert says",edition.cnn.com,2018-10-03 08:13:11,1 days 13:40:04.191643000,6
476,11,U.S. crude oil shipments to China 'totally stopped' amid trade war: shipping executive,reuters.com,2018-10-03 08:08:59,1 days 13:44:16.191644000,17
477,40900,"Thailand: bay made famous by The Beach closed indefinitely - One of the world’s most popular beaches, made famous by the 2000 film starring Leonardo DiCaprio, is to be closed indefinitely to allow it to recover from the damage caused by millions of tourists.",theguardian.com,2018-10-03 08:03:35,1 days 13:49:40.191644000,2006
478,5,"Venezuelan oil port repairs delayed, crude exports fall: sources",reuters.com,2018-10-03 07:56:58,1 days 13:56:17.191645000,13
479,2215,"Two paid sick days are too much. That was the message Tuesday from Premier Doug Ford, who is poised to dismantle the previous Liberal government’s labour reforms that increased sick day benefits and paid vacation, and were set to raise the minimum wage from $14 an hour to $15 on Jan. 1.",thestar.com,2018-10-03 07:55:58,1 days 13:57:17.191645000,644
480,5,Saudi woman barred from marrying 'musical' suitor,msn.com,2018-10-03 07:43:07,1 days 14:10:08.191646000,2
481,5,"New Zealand: Hand over phone password at border or face $3,200 fine",cnn.com,2018-10-03 07:40:32,1 days 14:12:43.191646000,9
482,5,"Canada's environmental watchdog says the federal government waited to take specific action to protect some of its most at-risk whales until the majestic creatures were already in great peril. ""I hope this is not too little, too late,"" Environment Commissioner Gelfand said",cbc.ca,2018-10-03 07:40:24,1 days 14:12:51.191646000,1
