,upvotes,title,site,time_posted,post_age,comment_no
483,1366,Italian populists sue black politician for calling their anti-immigrant party racist,dw.com,2018-10-03 07:39:13,1 days 14:14:02.191647000,584
484,8,"Amid a decline in terror incidents worldwide in 2017, African countries struggled to prevent the expansion of terror groups in parts of the continent, according to a U.S. State Department report on terrorism",voanews.com,2018-10-03 07:22:38,1 days 14:30:37.191647000,1
485,2,The Yves Bouvier Affair? Russian billionaire Rybolovlev files $380-million lawsuit against Sotheby’s,en.crimerussia.com,2018-10-03 07:21:59,1 days 14:31:16.191647000,0
486,116,First woman Physics Nobel winner in 55 years,bbc.com,2018-10-03 07:13:16,1 days 14:39:59.191648000,9
487,0,Russia: One of the ‘Kings of State Order’ detained as part of Billionaire-Colonel's corruption case,en.crimerussia.com,2018-10-03 07:11:48,1 days 14:41:27.191648000,0
488,0,‘Maneuvered to prevent collision’: Chinese destroyer chases USS Decatur in South China Sea,rt.com,2018-10-03 07:06:44,1 days 14:46:31.191648000,0
489,0,China ‘threatened with isolation’ by veto written into US-Mexico-Canada trade deal,scmp.com,2018-10-03 07:06:44,1 days 14:46:31.191649000,3
490,16,"Russia has delivered an S-300 surface-to-air missile system to Syria, it said Tuesday, in defiance of Israeli and U.S. concerns that the arms sale would embolden Iran and escalate the Syrian war",voanews.com,2018-10-03 07:04:38,1 days 14:48:37.191649000,4
491,91,"Spain dismantles 'Islamic State' ring operating in jails - A jihadist network spanning 17 prisons had attempted to radicalize inmates and establish a ""prison front,"" according to authorities. Several of the inmates were due to be released, posing a potential security risk.",dw.com,2018-10-03 06:57:51,1 days 14:55:24.191649000,15
492,10,"German Foreign Minister Heiko Maas: relations with US 'non-negotiable' - Heiko Maas is heading to Washington for talks and to open the Year of German American Friendship. On departure, he said transatlantic ties remained crucial, Donald Trump notwithstanding.",dw.com,2018-10-03 06:55:58,1 days 14:57:17.191650000,2
493,5,"Austria ridiculed for plan to ban 'extremist' hand signals, including one identical to Churchill's 'V for Victory': Far-Right interior ministry has been plunged into new contoversy over plans to ban “extremist” symbols including salutes used by Islamic extremists and Turkish and Kurdish nationalists",telegraph.co.uk,2018-10-03 06:54:12,1 days 14:59:03.191650000,2
494,21,Volcano erupts on same Indonesian island as earlier quake,apnews.com,2018-10-03 06:36:46,1 days 15:16:29.191650000,1
495,11,"Visitors entering New Zealand will have to disclose passwords for their electronic devices if they asked to by customs officials, or risk being slapped with a NZ$5,000 (US$3,300) fine.",channelnewsasia.com,2018-10-03 06:32:28,1 days 15:20:47.191651000,10
496,5,"CRA suspends, fines major Islamic charity over concerns it may have ‘provided resources’ to armed militants",globalnews.ca,2018-10-03 06:21:13,1 days 15:32:02.191651000,0
497,7,International Solar Alliance (ISA) could replace OPEC as key global energy supplier in future: Indian PM Modi,timesofindia.indiatimes.com,2018-10-03 06:11:43,1 days 15:41:32.191651000,2
498,13,Notorious French gangster who fled prison in helicopter caught: AFP.,cbsnews.com,2018-10-03 06:04:07,1 days 15:49:08.191652000,6
499,0,Volcano erupts on same Indonesian island as earlier quake,washingtonpost.com,2018-10-03 06:03:33,1 days 15:49:42.796799000,1
500,5,Brazil investors cheer as support rises for Bolsonaro's election bid,reuters.com,2018-10-03 06:00:37,1 days 15:52:38.796803000,1
501,5,Friends of Saudi dissident worried by absence at Istanbul consulate,reuters.com,2018-10-03 06:00:30,1 days 15:52:45.796803000,1
502,8,Trump: I told Saudi king he wouldn't last without U.S. support,reuters.com,2018-10-03 05:59:18,1 days 15:53:57.796804000,3
503,16,China orders 'X-Men' actress Fan Bingbing to pay $130 million tax fine,usatoday.com,2018-10-03 05:55:58,1 days 15:57:17.796804000,12
504,2,"New Zealand: Hand over phone password at border or face $3,200 fine",edition.cnn.com,2018-10-03 05:53:01,1 days 16:00:14.796805000,3
505,11,Thailand: bay made famous by The Beach closed indefinitely,amp.theguardian.com,2018-10-03 05:52:10,1 days 16:01:05.796805000,2
506,8,Fan Bingbing: missing Chinese actor hit with $129m tax bill | World news,theguardian.com,2018-10-03 05:41:35,1 days 16:11:40.796805000,1
507,4,"On Iran, White House Criticism Grows, but U.S. Military Posture Recedes",wsj.com,2018-10-03 05:41:30,1 days 16:11:45.796806000,1
508,4,Fan Bingbing: Top Chinese actress fined for tax evasion,bbc.com,2018-10-03 05:41:12,1 days 16:12:03.796806000,1
509,10,‘A message to Iran’s deep state’: France names Tehran’s spy service in plot to bomb meeting of exiles,independent.co.uk,2018-10-03 05:37:30,1 days 16:15:45.796807000,3
510,13,"North Sulawesi's Mt Soputan erupts, status raised to 'Alert' - National",thejakartapost.com,2018-10-03 05:08:55,1 days 16:44:20.796807000,0
511,0,‘49 pieces of hardware’: Syria gets S-300 missile system & more from Russia in wake of Il-20 downing,rt.com,2018-10-03 05:04:02,1 days 16:49:13.796807000,3
512,2518,Tonight a Virgin Atlantic 747 will fly on fuel made from industrial waste gas - Displacing jet fuel is a first step toward reducing the carbon footprint of flight.,arstechnica.com,2018-10-03 05:02:25,1 days 16:50:50.796808000,167
513,96,'Tampon tax' scrapped in Australia after 18-year controversy,bbc.co.uk,2018-10-03 05:00:51,1 days 16:52:24.796808000,28
514,19,Australian States and territories agree to axe 'tampon tax',smh.com.au,2018-10-03 04:55:43,1 days 16:57:32.796808000,4
515,5,Mexico state passed new “anti-meme” law,vallartadaily.com,2018-10-03 04:55:18,1 days 16:57:57.796809000,9
516,0,Saudi Arabia Ranks 4th among World’s Largest Donors of Humanitarian Aid,aawsat.com,2018-10-03 04:53:55,1 days 16:59:20.796809000,9
517,9,"Afghan election rally hit by suicide bomber, killing at least 13",bbc.com,2018-10-03 04:37:39,1 days 17:15:36.796809000,0
518,7,Kurdish moderate Barham Saleh elected Iraq president,france24.com,2018-10-03 04:10:15,1 days 17:43:00.796810000,1
519,12,Google and Facebook join rights groups to fight Australia's encryption bill - The bill gives law enforcement new powers to conduct covert surveillance on electronic devices and compel technology companies to assist in decrypting private communications.,theguardian.com,2018-10-03 03:45:50,1 days 18:07:25.796810000,4
520,19,"Ikea today symbolically unveiled its last single-use plastic straw in a display at London’s Design Museum, after it stopped serving or selling the items in any of its UK and Ireland stores, restaurants and bistros this week.",theguardian.com,2018-10-03 03:32:04,1 days 18:21:11.796810000,4
521,13,Toys ‘R’ Us Lenders Plan Brand’s Revival,wsj.com,2018-10-03 03:22:49,1 days 18:30:26.796811000,3
522,23,Trump: I told Saudi king he wouldn't last without U.S. support,reuters.com,2018-10-03 03:13:41,1 days 18:39:34.796811000,22
523,0,Key May Ally Warns U.K. Against Brexit Concessions on Ireland,bloomberg.com,2018-10-03 02:54:40,1 days 18:58:35.796811000,1
524,0,Toys'R'Us is coming back somewhat.,kotaku.com,2018-10-03 02:49:28,1 days 19:03:48.774250000,3
525,2,German detained in Turkey for defaming Erdogan: reports,dw.com,2018-10-03 02:39:41,1 days 19:13:35.774253000,3
526,10,French interior minister resigns in defiance of Emmanuel Macron,theguardian.com,2018-10-03 02:35:41,1 days 19:17:35.774254000,1
527,14,An Italian Mayor Who Gained Global Support for Helping Migrants Has Been Arrested,time.com,2018-10-03 02:27:04,1 days 19:26:12.774254000,5
528,13,Israeli soldiers fatally shoot elderly Palestinian farmer in central Gaza Strip,presstv.com,2018-10-03 02:23:56,1 days 19:29:20.774255000,39
529,26,"The United States is denying visas to the partners of more than 100 gay diplomats unless they get married, officials said Tuesday",france24.com,2018-10-03 02:05:32,1 days 19:47:44.774255000,20
530,66,China ‘threatened with isolation’ by veto written into US-Mexico-Canada trade deal A clause allowing any member of the North American trio to effectively block each-other’s free-trade deals seems aimed at China and is expected to feature in future US trade agreements,scmp.com,2018-10-03 02:04:44,1 days 19:48:32.774256000,48
531,314,"German firm fined millions in 'sausage cartel' case - Sausage prices had been artificially inflated in Germany for decades, according to the nation's anti-cartel authority. Food producer Wiltmann faces a large fine after refusing to hide behind the ""sausage loophole.""",dw.com,2018-10-03 01:16:36,1 days 20:36:40.774256000,36
532,16,"Germany's new immigration laws open door for skilled labor - A shortage of qualified workers is good incentive for change. Germany's coalition government has reached a deal on several key immigration issues, including making it easier for non-EU citizens to work in the country.",dw.com,2018-10-03 01:15:32,1 days 20:37:44.774256000,3
533,56,"Free trade deal gives Canadian broadcasters power to block U.S. Super Bowl ads again - None of the money raised by U.S. broadcasters from American ads goes to the Canadian rights holder, and vice versa.",cbc.ca,2018-10-03 01:11:31,1 days 20:41:45.774257000,13
534,27,"As Mexico marks 50th anniversary of Tlatelolco massacre, students say they're still under attack - Los Angeles Times",latimes.com,2018-10-03 00:57:39,1 days 20:55:37.774257000,2
535,9,Canada faces severe shortage of pilots and aircraft workers,ottawacitizen.com,2018-10-03 00:56:37,1 days 20:56:39.774257000,6
536,89,"Half of all those taking antidepressants experience withdrawal problems when they try to give them up and for millions of people in England, these are severe, according to a new review of the evidence commissioned by MPs.",theguardian.com,2018-10-03 00:51:45,1 days 21:01:31.774258000,33
537,12,"Another French Cabinet minister has resigned, the 3rd in 6 weeks",edition.cnn.com,2018-10-03 00:48:35,1 days 21:04:41.774258000,1
538,292,"U.S. NATO rep veers off Trump's script, praises Canada's contributions to alliance - 'Canada is doing so many things that are very important,' says Kay Bailey Hutchison",cbc.ca,2018-10-03 00:48:10,1 days 21:05:06.774258000,46
539,36,Tensions rise as US threatens to 'take out' Russian missiles,bbc.co.uk,2018-10-03 00:45:16,1 days 21:08:00.774259000,14
540,55300,Cervical cancer set to be eliminated from Australia in global first - Cervical cancer is set to become a rare disease in Australia within just two years and rendered so uncommon by 2028 it will be deemed eliminated as a public health problem for the first time anywhere in the world.,theage.com.au,2018-10-03 00:44:30,1 days 21:08:46.774259000,1730
541,2,Aung San Suu Kyi no longer an honorary Canadian citizen,beta.ctvnews.ca,2018-10-03 00:36:49,1 days 21:16:27.774260000,0
542,71,"British troops join forces with Japanese for first time on their soil amid North Korea tensions - A senior British General has said Japan ""will not have to fight alone"" as tensions over North Korea mount.",telegraph.co.uk,2018-10-03 00:25:00,1 days 21:28:16.774260000,10
543,52,Tampon tax to go in Australia,mobile.abc.net.au,2018-10-03 00:18:43,1 days 21:34:33.774261000,42
544,34,Senate votes to strip Aung San Suu Kyi of honorary Canadian citizenship,cbc.ca,2018-10-03 00:15:25,1 days 21:37:51.774261000,9
545,10,‘They are on notice’: Trump’s NATO envoy warns Russia that U.S. could ‘take out’ new missile system,nationalpost.com,2018-10-03 00:05:25,1 days 21:47:51.774261000,2
546,121,"Taking photos of 'spice zombies' is unhelpful, says UK council - It comes after images of people collapsed on street corners or slumped on benches after taking the synthetic cannabis substitute have spread online.",news.sky.com,2018-10-03 00:05:04,1 days 21:48:12.774262000,49
547,31,Poland Graduates to Developed Status,usnews.com,2018-10-03 00:04:48,1 days 21:48:28.774262000,0
548,0,An Italian mayor saved his village by welcoming migrants. Now he’s been arrested for it.,washingtonpost.com,2018-10-03 00:02:03,1 days 21:51:13.774262000,4
549,0,US threatens preemptive strike on Russian nuclear missiles,reuters.com,2018-10-02 23:54:05,1 days 21:59:12.534149000,12
550,38,Having acne in high school is positively correlated with a high GPA and successful university completion: study,phys.org,2018-10-02 23:33:47,1 days 22:19:30.534153000,26
551,19,Brazil poll shows far-right Bolsonaro beating leftist in run-off,reuters.com,2018-10-02 23:31:05,1 days 22:22:12.534153000,9
552,1,Bangladesh Delays Plans to Move Rohingya Refugees to Flood-Prone Island,irrawaddy.com,2018-10-02 23:26:46,1 days 22:26:31.534153000,0
553,2,"Taiwan Is Becoming A Top Destination For Artificial Intelligence In Asia | Artificial brains threaten to outnumber real ones in Taiwan, as the island's prowess in AI continues to grow",forbes.com,2018-10-02 23:26:16,1 days 22:27:01.534154000,0
554,0,NSW mother had sex with her young children to win over men online,smh.com.au,2018-10-02 23:20:41,1 days 22:32:36.534154000,15
555,2109,"Journalists are being jailed in unprecedented numbers across the globe, with 262 detained for their work at the end of 2017, according to the Committee to Protect Journalists",voanews.com,2018-10-02 23:19:08,1 days 22:34:09.534155000,162
556,116,Royal Family celebrates first same-sex marriage,ctvnews.ca,2018-10-02 23:14:24,1 days 22:38:53.534155000,17
557,15,Emirati rights activist who was handed a 10-year prison sentence earlier this year over several Twitter posts deemed insulting to the UAE has filed a Supreme Court appeal in a bid to overturn the sentence,aljazeera.com,2018-10-02 23:13:36,1 days 22:39:41.534155000,0
558,1,Kabul wants refugees back after Pakistan PM proposed nationality to Afghans,arabnews.com,2018-10-02 23:13:26,1 days 22:39:51.534156000,2
559,0,Germany's Economy Is at a Crossroads,link.mail.bloombergbusiness.com,2018-10-02 23:01:24,1 days 22:51:53.534156000,0
560,59,"China published its “Next Generation Artificial Intelligence Development Plan”, which laid out plans to ultimately become the world leader in AI. The 1st step of that plan is to catch up with the US on AI tech and apps by 2020.",multimedia.scmp.com,2018-10-02 22:19:44,1 days 23:33:33.534157000,46
561,12,Iraq Parliament elects Barham Salih as country’s new president,bbc.com,2018-10-02 21:55:45,1 days 23:57:32.534157000,2
562,17,Macron's 'En Marche' kicks off election campaign in Germany,euractiv.com,2018-10-02 21:01:03,2 days 00:52:14.534157000,1
563,113,"Donald Trump's trade war with China could lead to military conflict, Alibaba founder Jack Ma warns",newsweek.com,2018-10-02 20:41:52,2 days 01:11:25.534158000,147
564,10,newly elected Quebec premier François Legault says he is prepared to invoke the notwithstanding clause to ban hijabs from civil service - Canada,cbc.ca,2018-10-02 20:30:44,2 days 01:22:33.534158000,19
565,18,Russia and India 'set to sign $5bn S-400 missile deal',aljazeera.com,2018-10-02 20:22:07,2 days 01:31:10.534158000,7
566,62,B.C. tables bill to clear the way for lawsuit against opioid makers,theglobeandmail.com,2018-10-02 20:09:36,2 days 01:43:41.534159000,9
567,69,Russia delivers S-300 system to Syria,ynetnews.com,2018-10-02 20:02:39,2 days 01:50:38.534159000,22
568,56,"Funeral meal leaves at least 9 dead, dozens sick in Peru",nbcnews.com,2018-10-02 20:00:27,2 days 01:52:50.534160000,12
569,91,European Parliament votes to cancel 70 mln euros for Turkey,ahvalnews.com,2018-10-02 19:58:20,2 days 01:54:57.534160000,7
570,47,Deaths of high-profile Iraqi women spark fear of conservative backlash | World news,theguardian.com,2018-10-02 19:56:36,2 days 01:56:41.534160000,8
571,31,Stranded Syrian is arrested after living in airport for 7 months,nbcnews.com,2018-10-02 19:51:47,2 days 02:01:30.534161000,12
572,8,MEPs vote to ensure that at least 30% of content provided by online media platforms such as Amazon and Netflix is European.,euractiv.com,2018-10-02 19:51:18,2 days 02:01:59.534161000,9
573,7,Pompeo to head to Pyongyang for weekend talks with North Korean leader,reuters.com,2018-10-02 19:49:04,2 days 02:04:13.534161000,6
574,20,Ministers support giving more powers to EU watchdog to fight money launderers,euractiv.com,2018-10-02 19:48:21,2 days 02:04:57.040736000,1
575,7,India watches for deadly virus as lion deaths spike,economictimes.com,2018-10-02 19:41:41,2 days 02:11:37.040740000,2
576,28,"Spyware hijacks smartphones, threatens journalists around the world",cjr.org,2018-10-02 19:40:22,2 days 02:12:56.040741000,28
577,9,Russia sends S-300 missile system to Syria,bbc.com,2018-10-02 19:32:32,2 days 02:20:46.040741000,3
578,3,Russia deploys S-300 to Syria by largest military transport aircraft,presstv.com,2018-10-02 19:31:12,2 days 02:22:06.040741000,1
579,54,Thieves steal entire German vineyard,bbc.com,2018-10-02 19:29:11,2 days 02:24:07.040742000,21
580,8,"India looking to generate 40% power from non-fossil fuel by 2030, says Modi",livemint.com,2018-10-02 19:26:06,2 days 02:27:12.040742000,0
581,5,"Introducing ‘The Goblin’: A new, distant dwarf planet bolsters evidence for Planet X",astronomy.com,2018-10-02 19:24:31,2 days 02:28:47.040742000,9
582,7,Incoming Mexico government promises probe of 43 students' disappearance,reuters.com,2018-10-02 19:23:16,2 days 02:30:02.040743000,2
583,78,Mexico: A country now of mass graves,9news.com.au,2018-10-02 19:21:00,2 days 02:32:18.040743000,71
584,3,Defiant Italy says no turning back on budget despite EU 'threats',reuters.com,2018-10-02 19:16:06,2 days 02:37:12.040744000,5
585,9,Autopsies in the street: Oaxaca Morgues at maximum capacity.,mexiconewsdaily.com,2018-10-02 19:15:58,2 days 02:37:20.040744000,0
586,8,IAEA says it won't take intelligence at face value after Netanyahu's Iran speech,reuters.com,2018-10-02 19:15:18,2 days 02:38:00.040744000,9
587,10,Ex-Miss Iraq 'receives death threats',bbc.com,2018-10-02 19:14:38,2 days 02:38:40.040745000,10
588,8,Islamic State announces death of senior militant in Egypt's Sinai,reuters.com,2018-10-02 19:14:16,2 days 02:39:02.040745000,1
589,36,Germany arrests eighth suspect linked to group which attacked foreigners,reuters.com,2018-10-02 19:13:38,2 days 02:39:40.040745000,4
590,3,Spanish government rejects Catalan ultimatum on self-determination,reuters.com,2018-10-02 19:11:45,2 days 02:41:33.040746000,0
591,11,Ukraine minister says Skripal suspect helped ex-leader flee in 2014,reuters.com,2018-10-02 19:10:37,2 days 02:42:41.040746000,1
592,0,'Good chance' Danske whistleblower will testify in European Parliament: lawyer,reuters.com,2018-10-02 19:10:02,2 days 02:43:16.040746000,0
593,3,Iraqi parliament elects Kurdish politician Barham Salih president,reuters.com,2018-10-02 19:09:29,2 days 02:43:49.040747000,1
594,490,"Iranian FM: ""Holocaust no reason to deprive others of a homeland""",jpost.com,2018-10-02 19:07:00,2 days 02:46:18.040747000,632
595,41,Saudi writer Jamal Khashoggi 'disappears after consulate visit': Dissident reporter Jamal Khashoggi went to sort out paper work at the Saudi consulate in Istanbul but never returned.,aljazeera.com,2018-10-02 19:05:20,2 days 02:47:58.040747000,4
596,26,S-300 missile system: Russia upgrades Syrian air defences,bbc.com,2018-10-02 19:00:02,2 days 02:53:16.040748000,8
597,4,Iraq: Parliament elects Barham Salih as new president,aljazeera.com,2018-10-02 18:56:20,2 days 02:56:58.040748000,0
598,18,Parliament elects Kurdish politician Barham Salih president of Iraq,english.alarabiya.net,2018-10-02 18:53:22,2 days 02:59:56.040748000,1
599,15,"Russia, India to sign S-400 missile deal this week: Kremlin",in.reuters.com,2018-10-02 18:50:42,2 days 03:02:36.547387000,0
600,0,Italian deputy PM threatens to sue EU boss over budget criticism,theguardian.com,2018-10-02 18:49:34,2 days 03:03:44.547391000,0
601,18,"Israeli organizations begin relief operations in Indonesia after Tsunami, Despite no Diplomatic Relations",jpost.com,2018-10-02 18:46:33,2 days 03:06:45.547391000,2
602,9,US threatens to 'take out' Russian missiles if Moscow keeps violating nuclear treaty,cnn.com,2018-10-02 18:29:14,2 days 03:24:04.547392000,16
603,21,Saudi dissident journalist missing after visiting consulate in Istanbul,middleeasteye.net,2018-10-02 18:27:51,2 days 03:25:27.547392000,1
604,0,"Mexico: 50 Years After Tlatelolco Massacre, 50 Years of Impunity",telesurtv.net,2018-10-02 18:26:06,2 days 03:27:12.547393000,1
605,0,Hundreds of Ferry Passengers Stranded in the Baltic Sea After Engine Malfunction,time.com,2018-10-02 18:20:16,2 days 03:33:02.547393000,1
606,7676,"McDonald's, Wetherspoon's and TGI Friday workers to go on strike together over 'poverty pay'",independent.co.uk,2018-10-02 17:57:53,2 days 03:55:25.547393000,1017
607,25,Russia: U.S. comments on possible destruction of Russian warheads are dangerous: TASS,reuters.com,2018-10-02 17:57:24,2 days 03:55:54.547394000,17
608,3,Mattis: US not planning to cut back 'one bit' of support for French operations in Mali,thehill.com,2018-10-02 17:47:29,2 days 04:05:49.547394000,6
609,31,Germany approves extradition of Iran official to Belgium,middleeastmonitor.com,2018-10-02 17:46:19,2 days 04:06:59.547394000,0
610,1,BMW says rivals are interested in joining forces on self-driving cars,reuters.com,2018-10-02 17:46:13,2 days 04:07:05.547395000,0
611,31,Carnage at Afghan election rally as suicide bomber strikes,reuters.com,2018-10-02 17:45:00,2 days 04:08:18.547395000,3
612,15,Colombia bears the brunt of Venezuela’s migrant crisis.,theepochtimes.com,2018-10-02 17:40:58,2 days 04:12:20.547396000,3
613,22,Pro-refugee Italian mayor arrested for 'aiding illegal migration',theguardian.com,2018-10-02 17:33:55,2 days 04:19:23.547396000,11
614,4,"Canadian Province, British Columbia’s Campaign To Stop Electoral Reform is Now in Full-Blown Fear-Mongering Mode",pressprogress.ca,2018-10-02 17:18:24,2 days 04:34:54.547396000,0
615,0,Taiwan Vice-President Chen Chien-jen will visit Vatican to 'deepen ties',straitstimes.com,2018-10-02 17:09:54,2 days 04:43:24.547397000,0
616,116,"The Irish government is going to ask citizens if they want to scrap daylight savings time. If the change happens, it could lead to Northern Ireland and the Republic of Ireland being in different time zones for seven months of the year",bbc.co.uk,2018-10-02 17:09:03,2 days 04:44:15.547397000,16
617,8,"India, Uzbekistan to work together to stabilise Afghanistan",m.timesofindia.com,2018-10-02 16:57:16,2 days 04:56:02.547397000,0
618,3,Japan's Kansai to help Zambia with world’s first mosquito repellant paint to combat malaria,reuters.com,2018-10-02 16:54:55,2 days 04:58:23.547398000,1
619,13,Pakistan Hints at Compromise on Jailed Doctor Who Helped US find and kill Osama bin Laden,voanews.com,2018-10-02 16:53:51,2 days 04:59:27.547398000,1
620,0,American and Chinese Warships Narrowly Avoid High-Seas Collision,nytimes.com,2018-10-02 16:53:30,2 days 04:59:48.547398000,2
621,5,US threatens to 'take out' Russian missiles if Moscow keeps violating nuclear treaty,edition.cnn.com,2018-10-02 16:53:11,2 days 05:00:07.547399000,11
622,11,"Russia, India to sign S-400 missile deal this week: Kremlin",yahoo.com,2018-10-02 16:44:31,2 days 05:08:47.547399000,12
623,1920,"A new dwarf planet called ""The Goblin"" has been discovered at the edge of our solar system. The world's strange orbital properties provide new evidence for the massive, undiscovered planet that astronomers call “Planet Nine.""",astronomy.com,2018-10-02 16:42:27,2 days 05:10:51.547399000,606
624,71000,Carlsberg glues beer cans together becoming one of the first breweries to abandon plastic rings,telegraph.co.uk,2018-10-02 16:41:53,2 days 05:11:26.165276000,2255
625,601,"Foiled Paris attack plot was ordered by Tehran, French official says",timesofisrael.com,2018-10-02 16:37:12,2 days 05:16:07.165280000,185
626,0,Ferry with 335 people on board powerless in Baltic Sea,yahoo.com,2018-10-02 16:34:28,2 days 05:18:51.165281000,0
627,2,Maldives President Yameen 'received $1.5m in cash' before vote,aljazeera.com,2018-10-02 16:29:08,2 days 05:24:11.165281000,0
628,5,Dozens killed in Ethiopia ethnic clashes,aljazeera.com,2018-10-02 16:28:15,2 days 05:25:04.165282000,4
629,15,French police raid Islamic center suspected of terror links,dw.com,2018-10-02 16:27:06,2 days 05:26:13.165282000,2
630,3,U.S. would destroy banned Russian warheads if necessary: NATO envoy,reuters.com,2018-10-02 16:19:54,2 days 05:33:25.165282000,1
631,13,NATO gears up for 'biggest' military 'exercises in many years' - Business Insider,businessinsider.com,2018-10-02 16:17:10,2 days 05:36:09.165283000,2
632,0,"We won't compromise our principles to rescue the Tory party from Brexit, Guy Verhofstadt warns Theresa May",independent.co.uk,2018-10-02 16:13:36,2 days 05:39:43.165283000,4
633,0,Rescue operation for Baltic ferry,bbc.com,2018-10-02 16:06:44,2 days 05:46:35.165284000,0
634,12200,"Russia claims it has killed 85,000 terrorists and zero civilians in Syria: The Syrian Observatory for Human Rights say Russian air strikes and artillery shells have killed 18,000 people, including nearly 8,000 civilians.",businessinsider.com,2018-10-02 16:03:01,2 days 05:50:18.165284000,875
635,17,US Nato envoy's threat to Russia: stop developing missile or we'll 'take it out',theguardian.com,2018-10-02 15:56:21,2 days 05:56:58.165284000,9
636,2,Macron under fire for Caribbean photograph,edition.cnn.com,2018-10-02 15:54:55,2 days 05:58:24.165285000,9
637,6,Digital tax to target tech giants being considered by the Australian Government,abc.net.au,2018-10-02 15:54:36,2 days 05:58:43.165285000,1
638,7,Saudi woman barred from marrying 'musical' suitor,al-monitor.com,2018-10-02 15:53:17,2 days 06:00:02.165285000,7
