,upvotes,title,site,time_posted,post_age,comment_no
164,3,US threatens to 'take out' Russian missiles if Moscow keeps violating nuclear treaty,edition.cnn.com,2018-10-04 11:23:42,0 days 10:29:24.162250000,6
165,57,Netherland authorities accuse Russia of targeting OPCW and MH17 investigation,edition.cnn.com,2018-10-04 11:22:54,0 days 10:30:12.162251000,5
166,7,"The wife of ex-Malaysian Prime Minister Najib Razak has been charged with money laundering and tax evasion, as part of an investigation into a massive corruption scandal.",bbc.com,2018-10-04 11:19:42,0 days 10:33:24.162251000,1
167,0,Car sales plunge as Nissan warns on Brexit,bbc.com,2018-10-04 11:12:31,0 days 10:40:35.162252000,0
168,6,Japan's Abe claims lone woman in his cabinet worth 'two or three' amid criticism,cnn.com,2018-10-04 11:09:07,0 days 10:43:59.162252000,0
169,7,Russia 'targeted chemical weapons body',bbc.co.uk,2018-10-04 11:06:02,0 days 10:47:04.162252000,4
170,1031,Poll: Trump increasingly unpopular globally - except in Israel,israelnationalnews.com,2018-10-04 11:03:09,0 days 10:49:57.162253000,355
171,22,"23 endangered Asiatic lions are dead in last 20 days in Gujarat, India",dailymail.co.uk,2018-10-04 10:59:42,0 days 10:53:24.162253000,4
172,18,UK man rescued after 'living in six-foot shed for 40 years',edition.cnn.com,2018-10-04 10:55:23,0 days 10:57:43.162253000,4
173,3,Federal judge rules that Tesla must defend itself at a trial over allegations it knew foreign workers at its assembly plant were threatened with deportation if they reported an injury and worked long shifts that violated forced labour laws,reuters.com,2018-10-04 10:54:38,0 days 10:58:28.162254000,0
174,9,"Saak Karapetyan, Deputy General Prosecutor of Russia, just died in a helicopter crash in Kostroma, Russia. He was official who signed documents prepared by Natalia Veselnitskaya sent to US DOJ to try exonerate Prevezon in US money laundering case",themoscowtimes.com,2018-10-04 10:54:37,0 days 10:58:29.787656000,4
175,2,Burkina Faso gendarme killed in attack on Inata gold mine in Soum province,thedefensepost.com,2018-10-04 10:51:09,0 days 11:01:57.787660000,0
176,37,UK exposes Russian cyber attacks,gov.uk,2018-10-04 10:49:27,0 days 11:03:39.787661000,4
177,4,"Tesla to face charges that it threatened to deport workers if they reported injuries - Workers claim they were paid less than minimum wage, and that Tesla threatened to deport foreign employees if they reported work-related injuries and withhold their wages if they called into work sick",mercurynews.com,2018-10-04 10:37:00,0 days 11:16:06.787661000,0
178,25,"Up to 10,000 attend rally in Dublin demanding end to the country's housing crisis",irishtimes.com,2018-10-04 10:33:01,0 days 11:20:05.787662000,4
179,17800,"Dutch security services expelled four Russians in April over a plot targeting the global chemical weapons watchdog, officials said.",bbc.co.uk,2018-10-04 10:18:16,0 days 11:34:50.787662000,675
180,5,Singapore to replace paper arrival cards for foreign visitors with electronic version,channelnewsasia.com,2018-10-04 10:17:24,0 days 11:35:42.787662000,0
181,8,Russia Listed Among World Leaders in Selfie Deaths – Study,themoscowtimes.com,2018-10-04 10:10:03,0 days 11:43:03.787663000,3
182,10,"Indian man who tried to extort $500,000 from Standard Chartered Bank charged in court",straitstimes.com,2018-10-04 10:00:50,0 days 11:52:16.787663000,0
183,643,Tesla to face charges that it threatened to deport foreign workers if they reported injuries,mercurynews.com,2018-10-04 09:54:41,0 days 11:58:25.787663000,47
184,9,"Two men dead at Banham Poultry factory in Norfolk, UK, just hours after it went into administration",edp24.co.uk,2018-10-04 09:30:31,0 days 12:22:35.787664000,8
185,4,Greek fishermen claim Turkish coastguard tried to ram their boat,en.protothema.gr,2018-10-04 09:26:56,0 days 12:26:10.787664000,1
186,3896,Last pocket of ISIS' fighters surrounded,militarytimes.com,2018-10-04 09:20:19,0 days 12:32:47.787664000,758
187,4,False quake alarm gives Tokyoites a midnight scare | The Japan Times,japantimes.co.jp,2018-10-04 09:15:11,0 days 12:37:55.787665000,4
188,2,"Canada relieved trade deal done, won’t forget Trump attacks",apnews.com,2018-10-04 08:44:24,0 days 13:08:42.787665000,11
189,16,"US, Chinese unease as Putin seeks India arms deals",france24.com,2018-10-04 09:08:19,0 days 12:44:47.787665000,5
190,25,Deadly bacteria warning goes out to visitors of Berlin sex club,dw.com,2018-10-04 09:00:50,0 days 12:52:16.787666000,5
191,7,Six rescue divers drown trying to save teen in Malaysia,bbc.co.uk,2018-10-04 09:00:18,0 days 12:52:48.787666000,3
192,111,Netflix Eats Up 15% of All Internet Downstream Traffic Worldwide (Study),variety.com,2018-10-04 08:57:34,0 days 12:55:32.787667000,65
193,15,Fake News in Academia - Three scholars gulled academic journals to publish hoax papers on ‘grievance studies.’,areomagazine.com,2018-10-04 08:56:55,0 days 12:56:11.787667000,9
194,3,Car sales plunge as Nissan warns on Brexit,bbc.com,2018-10-04 08:46:12,0 days 13:06:54.787667000,0
195,2,"After trade deal win, Trump doubles down on China",aljazeera.com,2018-10-04 08:43:59,0 days 13:09:07.787668000,4
196,43,Germany's Merkel visits Holocaust memorial in Jerusalem,reuters.com,2018-10-04 08:20:05,0 days 13:33:01.787668000,6
197,6,Drunk police officer shoots dead two colleagues in Addis Ababa: state media,reuters.com,2018-10-04 08:42:14,0 days 13:10:52.787668000,1
198,59,UK points finger at Kremlin's military intelligence,bbc.co.uk,2018-10-04 08:33:28,0 days 13:19:38.787669000,6
199,6,Honda to invest $2.75 billion in GM's self-driving car unit,reuters.com,2018-10-04 08:32:50,0 days 13:20:17.438204000,1
200,10,Man and his 12 yo lover suspected of murder and cannibalism,en.crimerussia.com,2018-10-04 08:23:36,0 days 13:29:31.438207000,20
201,9,Indonesian anti-government activist Ratna Sarumpaet claimed she was assaulted. Turns out she was having a plastic surgery.,thejakartapost.com,2018-10-04 08:18:47,0 days 13:34:20.438208000,3
202,5,Six rescue divers in Malaysia drown while searching for missing teen,channelnewsasia.com,2018-10-04 08:16:49,0 days 13:36:18.438208000,1
203,5,Paramedics responding to reported shooting at Nepean Hospital in Sydney's west,abc.net.au,2018-10-04 07:43:02,0 days 14:10:05.438209000,1
204,7,Indonesia tsunami: crisis worsens as aid struggles to reach island,theguardian.com,2018-10-04 07:40:47,0 days 14:12:20.438209000,1
205,3,Dutch Christmas character Black Pete to shed blackface for TV,theguardian.com,2018-10-04 07:30:54,0 days 14:22:13.438209000,12
206,50600,Osaka has ended its 60-year “sister city” relationship with San Francisco to protest against the presence in the US city of a statue symbolising Japan’s wartime use of sex slaves.,theguardian.com,2018-10-04 07:29:01,0 days 14:24:06.438210000,6681
207,27,EU considers trade sanctions on Myanmar over Rohingya crisis,reuters.com,2018-10-04 07:23:32,0 days 14:29:35.438210000,41
208,18,Pompeo backs away from North Korea denuclearisation timeline,theguardian.com,2018-10-04 07:22:49,0 days 14:30:18.438211000,3
209,46,"World vulnerable to another financial meltdown, IMF warns",abc.net.au,2018-10-04 06:59:10,0 days 14:53:57.438211000,19
210,11,Paramedics responding to reported shooting at Nepean Hospital in Sydney's west,mobile.abc.net.au,2018-10-04 06:54:56,0 days 14:58:11.438211000,0
211,17,2 men arrested from K’taka charged with plotting Dalai Lama’s assassination in Bodh Gaya,thenewsminute.com,2018-10-04 06:38:07,0 days 15:15:00.438212000,12
212,728,"‘Terror being waged on wildlife', leaders warn - National and conservation leaders say the annihilation of nature is a dangerous ‘blight on humanity’, ahead of major summit",theguardian.com,2018-10-04 06:35:06,0 days 15:18:01.438212000,39
213,0,Wentworth byelection: Liberal vote collapses as poll shows safe seat now a close contest | Australia news,theguardian.com,2018-10-04 06:31:42,0 days 15:21:25.438212000,0
214,0,Russia’s growing threat to north Europe,economist.com,2018-10-04 06:25:45,0 days 15:27:22.438213000,7
215,3,New Zealand to fine travellers refusing to give device passwords when requested,news.com.au,2018-10-04 06:21:21,0 days 15:31:46.438213000,13
216,26,North Korean hackers accused of stealing millions from global banks,foxnews.com,2018-10-04 06:13:19,0 days 15:39:48.438213000,9
217,12,"Iraq’s New Leaders Seen as Technocrats, in a Break From Sectarian Politics",nytimes.com,2018-10-04 06:07:09,0 days 15:45:58.438214000,2
218,105,"A teacher accused of having sex with a 16-year-old pupil in a plane toilet admitted to police she had flirted with him, a jury has heard",theguardian.com,2018-10-04 06:04:58,0 days 15:48:09.438214000,82
219,3,US Vice President Pence set to inflame China tensions: 'We will not be intimidated',edition.cnn.com,2018-10-04 06:03:32,0 days 15:49:35.438214000,8
220,6,"Mexican mystery leaves locals tied, naked to lamposts in Puerto Vallarta",nzherald.co.nz,2018-10-04 05:55:48,0 days 15:57:19.438215000,5
221,10,"Merkel begins visit to Israel with Iran, Palestinians on agenda",reuters.com,2018-10-04 05:54:56,0 days 15:58:11.438215000,3
222,14,U.S. first lady Melania Trump lays wreath at slave castle in Ghana,reuters.com,2018-10-04 05:53:33,0 days 15:59:34.438215000,12
223,6,Pence to tell China: We will not be intimidated in South China Sea,reuters.com,2018-10-04 05:52:10,0 days 16:00:57.438216000,11
224,2,UK's May planning to rush Brexit through parliament: Bloomberg,reuters.com,2018-10-04 05:51:39,0 days 16:01:28.836742000,3
225,5,US Airstrike Kills 9 al-Shabab Militants in Somalia,voanews.com,2018-10-04 05:45:22,0 days 16:07:45.836745000,0
226,12,Anatoliy Chepiga Is a Hero of Russia: The Writing Is on the Wall,bellingcat.com,2018-10-04 05:28:02,0 days 16:25:05.836746000,0
227,45,"Astronomers discover first suspected 'exomoon' 8,000 light years away",theguardian.com,2018-10-04 05:24:12,0 days 16:28:55.836746000,3
228,13,"China Wants To End Trade War But 'U.S. Position Keeps Changing,' Ambassador Says",npr.org,2018-10-04 05:19:28,0 days 16:33:39.836746000,16
229,17,"Apple, Google and Amazon named as most valuable brands in world",theguardian.com,2018-10-04 05:14:58,0 days 16:38:09.836747000,9
230,5,Peru's high court overturns pardon of former strongman Fujimori | World news,theguardian.com,2018-10-04 05:11:01,0 days 16:42:06.836747000,0
231,2451,Facebook faces $1.6bn fine and formal investigation over massive data breach,theguardian.com,2018-10-04 05:05:07,0 days 16:48:00.836748000,231
232,4,Beijing develops self-driving sanitation vehicle - Xinhua,xinhuanet.com,2018-10-04 04:53:01,0 days 17:00:06.836748000,1
233,4,"Trump is right that China uses its media to influence foreign opinion, but so does Washington",cnn.com,2018-10-04 04:52:20,0 days 17:00:47.836748000,13
234,199,"Cristiano Ronaldo will face prison time if found guilty, attorney says",usatoday.com,2018-10-04 04:43:58,0 days 17:09:09.836749000,84
235,15,EU launches €1B project to build world’s fastest supercomputer,sciencebusiness.net,2018-10-04 04:37:38,0 days 17:15:29.836749000,5
236,631,Putin Signs Unpopular Bill Raising Retirement Ages By Five Years,rferl.org,2018-10-04 04:36:34,0 days 17:16:33.836749000,155
237,12,Calls for Justin Trudeau to rebuff President Trump's mocking of Blasey Ford,msn.com,2018-10-04 04:25:10,0 days 17:27:57.836750000,11
238,47,Victims of forced sterilisation in Japan fight for compensation,economist.com,2018-10-04 04:25:02,0 days 17:28:05.836750000,4
239,55,UK: Russian spies behind the supposed ISIS ‘Cyber Caliphate’,washingtonexaminer.com,2018-10-04 04:09:42,0 days 17:43:25.836750000,39
240,8,South Korean Lawmaker Heads Rally in Washington to Oppose end-of-war Declaration With N Korea,sputniknews.com,2018-10-04 04:07:45,0 days 17:45:22.836751000,3
241,7,South Korea's economy is slowing. Its leader still wants to spend millions on Pyongyang,cnbc.com,2018-10-04 04:06:36,0 days 17:46:31.836751000,7
242,66,Indonesian soldiers ordered to fire on looters in disaster zone,channelnewsasia.com,2018-10-04 04:04:31,0 days 17:48:36.836752000,26
243,25,Woman hit by golf ball at Ryder Cup: People took photos instead of helping,news.sky.com,2018-10-04 03:58:21,0 days 17:54:46.836752000,22
244,12,Vietnam's Former Communist Party Chief Do Muoi Dies at 101,time.com,2018-10-04 03:57:45,0 days 17:55:22.836752000,3
245,7,"The Australian government is jointly responsible for Nauru’s media access policy for the immigration detention centre, departmental documents reveal, despite claims for years that it is solely an issue for Nauru.",theguardian.com,2018-10-04 03:54:47,0 days 17:58:20.836753000,0
246,17,Mike Pence to warn against Chinese 'intimidation' in South China Sea,theguardian.com,2018-10-04 03:53:49,0 days 17:59:18.836753000,10
247,12,Indonesia earthquake: soil liquefaction blamed for building collapses,theguardian.com,2018-10-04 03:49:59,0 days 18:03:08.836753000,0
248,9,Contaminated vaccines put India’s ‘polio free’ status at risk,m.timesofindia.com,2018-10-04 03:30:21,0 days 18:22:46.836754000,1
249,12,UK blames Russian military for 'reckless' cyber attacks,edition.cnn.com,2018-10-04 03:28:36,0 days 18:24:32.542165000,3
250,31,"India, in a first, sends seven Rohingya for deportation to Myanmar",in.reuters.com,2018-10-04 03:27:43,0 days 18:25:25.542168000,12
251,4,Vietnam nominates Communist Party chief to become president,washingtonpost.com,2018-10-04 03:22:23,0 days 18:30:45.542169000,3
252,1,Malaysia ex-PM’s wife to face money laundering charges,washingtonpost.com,2018-10-04 03:20:38,0 days 18:32:30.542169000,1
253,25,"Russian President Vladimir Putin arrives in India today, likely to sign 20 agreements | The Indian Express",indianexpress.com,2018-10-04 02:58:21,0 days 18:54:47.542169000,5
254,32,UK accuses Russian spies of cyber attacks,bbc.co.uk,2018-10-04 02:52:30,0 days 19:00:38.542170000,0
255,14,Nicaragua deports reporter who covered anti-Ortega protests | World news,theguardian.com,2018-10-04 02:50:30,0 days 19:02:38.542170000,0
256,26,Osaka cuts sister city ties with San Francisco over 'comfort women' statue,japantoday.com,2018-10-04 02:44:57,0 days 19:08:11.542171000,37
257,2,People entering New Zealand may now be prosecuted and fined if they refuse to allow access to their digital devices,nytimes.com,2018-10-04 02:40:59,0 days 19:12:09.542171000,15
258,32,An Australian university has developed a font that promises to improve memory and information recall.,theage.com.au,2018-10-04 02:11:40,0 days 19:41:28.542171000,8
259,73,"A federal judge issued a preliminary injunction on Wednesday evening, temporarily blocking the Trump administration from ending the Temporary Protected Status (TPS) program for over 300,000 immigrants from Haiti, El Salvador, Honduras and Sudan",thehill.com,2018-10-04 02:05:58,0 days 19:47:10.542172000,5
260,37,‘Pretty darn Canadian’: Trumpet player serenades snow-stranded drivers on Alberta highway,globalnews.ca,2018-10-04 02:03:32,0 days 19:49:36.542172000,8
261,10,Erik Prince’s Russian Connection Trawled Trumpland for ‘Boss’ Putin,thedailybeast.com,2018-10-04 01:49:45,0 days 20:03:23.542172000,3
262,20,Germany to further ease immigration rules,yahoo.com,2018-10-04 01:32:15,0 days 20:20:53.542173000,33
263,31,"Today, the Australian Government has joined international partners to condemn a pattern of malicious cyber activity by Russia targeting political, business, media and sporting institutions worldwide.",pm.gov.au,2018-10-04 01:31:19,0 days 20:21:49.542173000,0
264,9,Trump says Saudi King wouldn't last 'two weeks' without US support,edition.cnn.com,2018-10-04 01:14:51,0 days 20:38:17.542173000,14
265,86,Erik Prince’s Russian Connection Trawled Trumpland for ‘Boss’ Putin,thedailybeast.com,2018-10-04 01:11:02,0 days 20:42:06.542174000,9
266,5,Erik Prince’s Russian Connection Trawled Trumpland for ‘Boss’ Putin,thedailybeast.com,2018-10-04 01:10:42,0 days 20:42:26.542174000,2
267,16,North Korea said to have stolen a fortune in online bank heists,apnews.com,2018-10-04 01:08:34,0 days 20:44:34.542174000,4
268,674,"U.S. withdraws from international accords, says U.N. world court 'politicized'",reuters.com,2018-10-04 01:05:05,0 days 20:48:03.542175000,260
269,122,Cannabis 'more harmful than alcohol' for teen brains - Study from Canada,bbc.com,2018-10-04 00:45:54,0 days 21:07:14.542175000,128
270,9,Trump was 'tolerant' in trade talks: Mexico president-elect,reuters.com,2018-10-04 00:45:48,0 days 21:07:20.542175000,4
271,33,"Mexican president-elect, Trump agree economic development can stem illegal migration",reuters.com,2018-10-04 00:43:55,0 days 21:09:13.542176000,7
272,3272,Trump says Saudi King wouldn't last 'two weeks' without US support,edition.cnn.com,2018-10-04 00:29:04,0 days 21:24:04.542176000,787
273,3,Yemen separatists call for uprising as U.N. pursues peace,reuters.com,2018-10-04 00:11:43,0 days 21:41:25.542177000,2
274,91,A French gangster who busted out of jail in a helicopter has been caught after 3 months on the run,businessinsider.com,2018-10-03 23:51:51,0 days 22:01:18.236503000,18
275,36,Prehistoric art hints at lost Indian civilisation,bbc.com,2018-10-03 23:51:40,0 days 22:01:29.236506000,2
276,0,World congratulates China on National Day - Xinhua,xinhuanet.com,2018-10-03 23:35:29,0 days 22:17:40.236507000,7
277,1356,Britain says Russian military intelligence behind host of global cyber attacks,reuters.com,2018-10-03 23:29:24,0 days 22:23:45.236507000,147
278,2,Syria's Assad says 'understanding' reached with Arab states,apnews-com.cdn.ampproject.org,2018-10-03 23:26:21,0 days 22:26:48.236507000,0
279,14,"Alberto fujimori (ex president of peru) , who was released of jail in december 2017, is ordered back to prison",reuters.com,2018-10-03 23:21:20,0 days 22:31:49.236508000,3
280,6,Putin calls poisoned ex-spy Skripal a scumbag and traitor,reuters.com,2018-10-03 23:20:10,0 days 22:32:59.236508000,3
281,14,Reckless campaign of cyber attacks by Russian military intelligence service exposed,ncsc.gov.uk,2018-10-03 23:15:21,0 days 22:37:48.236508000,1
282,27,UK accuses Kremlin of ordering series of 'reckless' cyber-attacks | Technology,theguardian.com,2018-10-03 23:11:07,0 days 22:42:02.236509000,1
283,29,US Navy proposing major show of force to warn China,cnn.com,2018-10-03 23:09:55,0 days 22:43:14.236509000,31
284,3,UK blames ‘reckless’ cyber attacks on Russia’s GRU spy agency,ft.com,2018-10-03 23:08:26,0 days 22:44:43.236510000,1
285,619,Commercial fishing banned across much of the Arctic,theguardian.com,2018-10-03 22:50:41,0 days 23:02:28.236510000,30
286,2724,"China, not North Korea, is biggest threat to peace, South Koreans say",scmp.com,2018-10-03 22:45:31,0 days 23:07:38.236510000,493
287,11,Trump Administration Tears Up Treaty In Latest Confrontation With Iran,time.com,2018-10-03 22:43:53,0 days 23:09:16.236511000,7
288,9,Anti-Israel group calls on E.U. to cancel Israeli-Palestinian gathering under the pretext that the event promotes normalization between the two people.,jpost.com,2018-10-03 22:35:01,0 days 23:18:08.236511000,7
289,14,'We say no': Manitoba defies Ottawa by killing its carbon tax plan,cbc.ca,2018-10-03 22:34:27,0 days 23:18:42.236511000,3
290,40,Australian Government sat on climate change report,mobile.abc.net.au,2018-10-03 22:20:54,0 days 23:32:15.236512000,4
291,24,China's 'aggressive tactics' in South China Sea worry Australian authorities,theguardian.com,2018-10-03 22:10:52,0 days 23:42:17.236512000,4
292,11,Sydney Airport triggers 'full emergency response' after United Airlines mayday call,abc.net.au,2018-10-03 22:08:15,0 days 23:44:54.236512000,16
293,25,"Astronomers discover the first ""exomoon"" orbiting a planet in another star system. According to new research, the bizarre moon is roughly the size of Neptune, and it orbits a Jupiter-sized exoplanet some 4,000 light-years away.",astronomy.com,2018-10-03 22:04:42,0 days 23:48:27.236513000,15
294,6,"Two major incidents between US military and China, Russia in the air and at sea",abcnews.go.com,2018-10-03 22:00:51,0 days 23:52:18.236513000,0
295,26,"Moscow State Linguistic University: The news director of RT America, Mikhail Solodovnikov, plagiarized substantial parts of his Ph.D. dissertation",euvsdisinfo.eu,2018-10-03 21:47:12,1 days 00:05:57.236513000,3
296,7,China hires 12 banks for sovereign dollar bond issue,reuters.com,2018-10-03 21:24:22,1 days 00:28:47.236514000,3
297,0,Trump administration sees a 7-degree rise in global temperatures by 2100,washingtonpost.com,2018-10-03 21:15:22,1 days 00:37:47.236514000,7
298,0,Greek PM Tsipras and Macedonian PM Zaev reportedly in the running for Nobel Peace Prize,euractiv.com,2018-10-03 21:09:37,1 days 00:43:32.236514000,6
299,5,LNG project between Canada and Asian partners to move forward,bbc.com,2018-10-03 21:08:48,1 days 00:44:22.405256000,0
300,7,Israel can beat Russian-supplied S-300 air shield in Syria: minister,reuters.com,2018-10-03 21:07:31,1 days 00:45:39.405260000,21
301,3,"With exports to Jordan and Egypt, Israel becoming key player in Mideast gas market",haaretz.com,2018-10-03 21:04:07,1 days 00:49:03.405261000,2
302,57,ISIS chief Abu Bakr al-Baghdadi's son 'killed in Russian airstrike',dailymail.co.uk,2018-10-03 21:03:37,1 days 00:49:33.405261000,21
303,6364,"Amazon offsetting pay rise by slashing benefits for UK warehouse workers, union says",theguardian.com,2018-10-03 21:01:19,1 days 00:51:51.405262000,745
304,16,European Commission vice-president Frans Timmermans has warned Romania's government that it might end up in court if it does reverse judicial reforms that he said undermined the fight against corruption in the country.,euobserver.com,2018-10-03 20:58:19,1 days 00:54:51.405262000,3
305,23,Romania loses voting right at European Space Agency due to unpaid debts,romania-insider.com,2018-10-03 20:54:06,1 days 00:59:04.405262000,4
306,1,France to act by decree as plans for no-deal Brexit accelerate,ft.com,2018-10-03 20:50:05,1 days 01:03:05.405263000,1
307,3,"World's rarest whisky set to go under the hammer - The bottle is estimated to go for over £700,000.",stv.tv,2018-10-03 20:49:26,1 days 01:03:44.405263000,10
308,14,Another powerful typhoon barrels toward Japan - Typhoon Kong-rey will be the ninth tropical system of the season to impact Japan this year,edition.cnn.com,2018-10-03 20:36:54,1 days 01:16:16.405264000,0
309,9,‘Groundbreaking’ alcohol Bill passed by Dáil after almost three years - Irish government pass public health alcohol bill with aim to reduce alcohol consumption,irishtimes.com,2018-10-03 20:34:41,1 days 01:18:29.405264000,5
310,0,New Nafta Shows Limits of ‘America First’,wsj.com,2018-10-03 20:31:51,1 days 01:21:19.405264000,0
311,13,British tech industry: the Hammond's 'digital tax' could preclude British tech startups from expanding,telegraph.co.uk,2018-10-03 20:20:54,1 days 01:32:16.405265000,3
312,4,NPR reports uncertainty regarding the Morocco's Chinese-Funded project 'Tech City',npr.org,2018-10-03 20:09:01,1 days 01:44:09.405265000,0
313,37,Near-collision of US warship and 'aggressive' Chinese Destroyer in South China Sea captured in photos,abc.net.au,2018-10-03 20:06:08,1 days 01:47:02.405266000,84
314,26800,Artificial sweeteners are toxic to digestive gut bacteria: study,cnbc.com,2018-10-03 20:01:59,1 days 01:51:11.405266000,1895
315,4,US to offer cyberwar capabilities to NATO allies,cnbc.com,2018-10-03 19:47:37,1 days 02:05:33.405266000,4
316,2,"Days before trade deal, Trump said Canada’s foreign minister ‘hates America’",washingtonpost.com,2018-10-03 19:10:07,1 days 02:43:03.405267000,8
317,281,"In effort to curb child abuse, Anglican Church of Southern Africa now requires new clergy to obtain police clearance before being ordained.",iol.co.za,2018-10-03 19:05:38,1 days 02:47:32.405267000,19
318,5,Worries over China coal power boom - China's efforts to curb new coal plant buildout may be failing,bbc.com,2018-10-03 18:59:47,1 days 02:53:23.405267000,1
319,232,"National Security Advisor John Bolton has called Iran a 'rogue regime', shortly after the US announced it is terminating a 1955 treaty over calls to end sanctions that impact the import of humanitarian goods and products to the country.",independent.co.uk,2018-10-03 18:55:35,1 days 02:57:35.405268000,149
320,12,French nuclear output drops to 41 GW on three unplanned outages,spglobal.com,2018-10-03 18:52:47,1 days 03:00:23.405268000,1
321,11,"Iran says Saudi Arabia, Russia violated OPEC deal on output cuts.",uk.reuters.com,2018-10-03 18:49:42,1 days 03:03:28.405268000,4
322,6,"Desperate border crossings, as Venezuela runs short of HIV drugs - Venezuela's economic meltdown has triggered the biggest exodus of people in modern Latin American history",news.trust.org,2018-10-03 18:48:56,1 days 03:04:14.405269000,2
323,4,Macron accepts interior minister Collomb's resignation in fresh blow to government - France 24,m.france24.com,2018-10-03 18:44:52,1 days 03:08:18.405269000,2
324,61,Tesla must defend lawsuit alleging abuse of foreign workers - European workers say they were threatened with deportation or reduced pay if they reported injuries or became ill and had to work 250 hours per month for less than $950,reuters.com,2018-10-03 18:41:55,1 days 03:11:16.079839000,7
325,6,Beirut residents warned about a Hezbollah site in Whatsapp message,ynetnews.com,2018-10-03 18:41:21,1 days 03:11:50.079843000,0
326,488,Trump's National Security Adviser John Bolton Says 'So-Called State of Palestine' Uses Air Quotes,newsweek.com,2018-10-03 18:40:33,1 days 03:12:38.079844000,300
327,11,"New Zealand to travelers: Hand over phone password at border or face $3,200 fine",edition.cnn.com,2018-10-03 18:39:45,1 days 03:13:26.079844000,25
